A1: Club de Ajedrez Agustín de Leiza

A1: » inicio » socios del club » cto. por equipos » últimos torneos » enlaces | B1: Liga Vasca 1a División 2006 volver a página principal Calendario 1a ronda 2a ronda 3a ronda 4a ronda 5a ronda 6a ronda 7a ronda 8a ronda 9a ronda Resultados individuales Orden de fuerzas 2006 Temporada 2005 1a Ronda En cuanto a los jugadores de liga vasca, conquistaron medio punto frente al poderoso equipo de Oberena que no alineó a su mejor equipo. En el primer tablero derrota de Iosu frente a Miguel Navarro, aunque según reconoció éste más tarde estuvo perdido en algún momento de la partida, en el segundo tablero más de lo mismo, Félix tuvo ventaja decisiva pero al final también palmó. En el tercer tablero es donde se consiguieron las tablas, Jose jugando una defensa francesa, y a pesar de alguna imprecisión logró el medio puntoo que se trae el equipo. En el último tablero Agustín perdió ante Daniel Zamarbide. ˆˆ subir 2a Ronda Los de liga vasca perdieron de nuevo abultadamente, aunque al parecer el transcurso de las partidas fue muy diferente, a falta de una crónica de los nuestros podemos leer la crónica del club de Fomento. ˆˆ subir 3a Ronda ˆˆ subir 4a Ronda En liga vasca esta jornada perdieron por la mínima aunque teniendo en cuenta que fue contra el líder de la competición no está nada mal. Iosu ganó su partida y Félix empató la suya, por contra Jose y Pani perdieron. S ˆˆ subir 5a Ronda En liga vasca el primer empate de la temporada con derrotas de Iosu y Félix y victorias de Jose y Agustín. Este resultado ante uno de los equipos destinados a descender, a priori, de la categoría deja al equipo prácticamente sin esperanzas de mantenerse, teniendo en cuenta que bajan 4 equipos. ˆˆ subir 6a Ronda En liga vasca primera victoria, por el contundente resultado de 3½ a ½ frente al equipo de Calasanz. Con victorias de Iosu, Félix y Agustín y tablas de Jose, este resultado da un pequeño (muy pequeño) rayo de esperanza de salvación. ˆˆ subir 7a Ronda La noticia viene en liga vasca con la segunda goleada consecutiva, otro 3½ a ½ esta vez a domicilio contra San Andrés (Mondragón). Victorias de Iosu, Félix y Pani y nuevas tablas de Jose. Jose según parece dio tablas en una posición que todavía se podía luchar por ganar mientras Iosu y Felix jugaron unas buenas partidas y ganaron "cómodamente", la victoria de Pani vino después de quedarse peor y con peón de menos pero la lucha se acabó cuando el contrario se dejó una torre. Con este resultado se mantiene las emperanzas de mantenerse e ¡incluso de subir! de momento se ha salido de la zona de descenso por mejor desempate que Zarauz. ˆˆ subir 8a Ronda En liga vasca derrota frente a Zuri Baltza por 3 a 1 con tablas de Iosu y Félix y derrotas de Jose y Agustín, que cayeron facilmente notándose la falta de experiencia en la categoría. Con este resultado la permanencia se pone muy difícil, ya que en la última ronda se necesita ganar con contundencia y el rival, que es uno de los equipos de la parte de arriba, no invita a la esperanza. ˆˆ subir 9a Ronda Empate de los de liga vasca ante Rey Ardid B, en lo que se puede considerar un buen resultado si no fuese porque con él descienden de categoría. En esta jornada Iosu ganó, Félix y Jose hicieron tablas y Agustín perdió, quizas se podría haber sacado más en alguna partida pero después del desastroso inicio la permanecia estaba muy cuesta arriba. Pero el año que viene ¡DÉRBI! ya estoy escuchando las apuestas. ˆˆ subir

B1: 1 | C1: 2 | D1: 3 | E1: 4 | F1: 5 | G1: 6 | H1: 7 | I1: 8 | J1: 9 | K1: 10 | L1: Puntos
2: 1 | A2: Rey Ardid B | C2: 2 | D2: 0.5 | E2: 2½ | F2: 3 | G2: 2½ | H2: 2½ | I2: 2 | J2: 2 | K2: 2 | L2: =SUM(C5:L5) -> 13.5
3: 2 | A3: Oberena | B3: 2 | D3: 0.5 | E3: 3 | F3: 1.5 | G3: 2 | H3: 2½ | I3: 3½ | J3: 3½ | K3: 2.5 | L3: =SUM(C6:L6) -> 8.5
4: 3 | A4: Fomento B | B4: 3.5 | C4: 3.5 | E4: 3 | F4: 0 | G4: 2½ | H4: 2 | I4: 3.5 | J4: 3.5 | K4: 4 | L4: =SUM(C7:L7) -> 16
5: 4 | A5: Zarautz A | B5: 1½ | C5: 1 | D5: 1 | F5: 2 | G5: 1½ | H5: 1.5 | I5: 2 | J5: 3 | K5: 2 | L5: =SUM(C8:L8) -> 11.5
6: 5 | A6: Sestao A | B6: 1 | C6: 2.5 | D6: 4 | E6: 2 | G6: 3.5 | H6: 4 | I6: 2.5 | J6: 3.5 | K6: 2 | L6: =SUM(C9:L9) -> 23½
7: 6 | A7: Amurrio A | B7: 1½ | C7: 2 | D7: 1½ | E7: 2½ | F7: 0.5 | H7: 3 | I7: 0.5 | J7: 2 | K7: 1.5 | L7: =SUM(C10:L10) -> 6.5
8: 7 | A8: Calasanz | B8: 1½ | C8: 1½ | D8: 2 | E8: 2.5 | F8: 0 | G8: 1 | I8: 2.5 | J8: 2.5 | K8: 0.5 | L8: =SUM(C11:L11) -> 11½
9: 8 | A9: S. Andrés | B9: 2 | C9: ½ | D9: 0.5 | E9: 2 | F9: 1.5 | G9: 3.5 | H9: 1.5 | J9: ½ | K9: 1 | L9: =SUM(C12:L12) -> 16½
10: 9 | A10: Eguzki Urnieta | B10: 2 | C10: ½ | D10: 0.5 | E10: 1 | F10: 0.5 | G10: 2 | H10: 1.5 | I10: 3½ | K10: 1 | L10: =SUM(C13:L13) -> 7.5
11: 10 | A11: Zuri Baltza | B11: 2 | C11: 1.5 | D11: 0 | E11: 2 | F11: 2 | G11: 2.5 | H11: 3.5 | I11: 3 | J11: 3 | L11: =SUM(C14:L14) -> 14.5

A1: 1a Jornada (14-01-2006)
A2: Rey Ardid B | B2: 2 | C2: 2 | D2: Zuri Baltza
A3: Oberena | B3: 3½ | C3: ½ | D3: Urnieta
A4: Fomento B | B4: 1 | C4: 3 | D4: S. Andrés
A5: Zarautz A | B5: 2 | C5: 2 | D5: Calasanz
A6: Sestao A | B6: 4 | C6: 0 | D6: Amurrio A

A1: 2a Jornada (21-01-2006)
A2: Zuri Baltza | B2: 2 | C2: 2 | D2: Amurrio A
A3: Calasanz | B3: 0 | C3: 4 | D3: Sestao A
A4: S. Andrés | B4: 2 | C4: 2 | D4: Zarautz A
A5: Urnieta | B5: ½ | C5: 3½ | D5: Fomento B
A6: Rey Ardid B | B6: 2 | C6: 2 | D6: Oberena

A1: 3a Jornada (28-01-2006)
A2: Oberena | B2: 1½ | C2: 2½ | D2: Zuri Baltza
A3: Fomento B | B3: 0 | C3: 4 | D3: Rey Ardid B
A4: Zarautz A | B4: 3 | C4: 1 | D4: Urnieta
A5: Sestao A | B5: 3 | C5: 1 | D5: S. Andrés
A6: Amurrio A | B6: 3 | C6: 1 | D6: Calasanz

A1: 4a Jornada (04-02-2006)
A2: Zuri Baltza | B2: 3.5 | C2: =4-B2 -> 0.5 | D2: Calasanz
A3: S. Andrés | B3: 3.5 | C3: =4-B3 -> 0.5 | D3: Amurrio A
A4: Urnieta | B4: 0.5 | C4: =4-B4 -> 3.5 | D4: Sestao A
A5: Rey Ardid B | B5: 2½ | C5: =4-B5 -> 1½ | D5: Zarautz A
A6: Oberena | B6: 0.5 | C6: =4-B6 -> 3.5 | D6: Fomento B

A1: 5a Jornada (11-02-2006)
A2: Fomento B | B2: 4 | C2: =4-B2 -> 0 | D2: Zuri Baltza
A3: Zarautz A | B3: 1 | C3: =4-B3 -> 3 | D3: Oberena
A4: Sestao A | B4: 1 | C4: =4-B4 -> 3 | D4: Rey Ardid B
A5: Amurrio A | B5: 2 | C5: =4-B5 -> 2 | D5: Urnieta
A6: Calasanz | B6: 2.5 | C6: =4-B6 -> 1.5 | D6: S. Andrés

A1: 6a Jornada (18-02-2006)
A2: Zuri Baltza | B2: 3 | C2: =4-B2 -> 1 | D2: S. Andres
A3: Urnieta | B3: 1.5 | C3: =4-B3 -> 2.5 | D3: Calasanz
A4: Rey Ardid B | B4: 2½ | C4: =4-B4 -> 1½ | D4: Amurrio A
A5: Oberena | B5: 1.5 | C5: =4-B5 -> 2.5 | D5: Sestao A
A6: Fomento B | B6: 3 | C6: =4-B6 -> 1 | D6: Zarautz A

A1: 7a Jornada (25-02-2006)
A2: Zarautz A | B2: 2 | C2: =4-Q59 -> 2 | D2: Zuri Baltza
A3: Sestao A | B3: 4 | C3: =4-Q60 -> 0 | D3: Fomento B
A4: Amurrio A | B4: 2 | C4: =4-Q61 -> 2 | D4: Oberena
A5: Calasanz | B5: 1½ | C5: =4-Q62 -> 2½ | D5: Rey Ardid B
A6: S. Andrés | B6: ½ | C6: =4-Q63 -> 3½ | D6: Urnieta

A1: 8a Jornada (04-03-2006)
A2: Zuri Baltza | B2: 3 | C2: =4-Q66 -> 1 | D2: Urnieta
A3: Rey Ardid B | B3: 2 | C3: =4-Q67 -> 2 | D3: S. Andrés
A4: Oberena | B4: 2½ | C4: =4-Q68 -> 1½ | D4: Calasanz
A5: Fomento B | B5: 2½ | C5: =4-Q69 -> 1½ | D5: Amurrio A
A6: Zarautz A | B6: 2 | C6: =4-Q70 -> 2 | D6: Sestao A

A1: 9a Jornada (11-03-2006)
A2: Sestao A | B2: 2 | C2: =4-Q73 -> 2 | D2: Zuri Baltza
A3: Amurrio A | B3: 2½ | C3: =4-Q74 -> 1½ | D3: Zarautz A
A4: Calasanz | B4: 2 | C4: =4-Q75 -> 2 | D4: Fomento B
A5: S. Andrés | B5: ½ | C5: =4-Q76 -> 3½ | D5: Oberena
A6: Urnieta | B6: 2 | C6: =4-Q77 -> 2 | D6: Rey Ardid B

A1: euskara | B1: contacto - localización