A1: Club de Ajedrez Agustín de Leiza

A1: » inicio » socios del club » cto. por equipos » últimos torneos » enlaces | B1: Liga Vasca 1ª División 2012 volver a página principal Calendario 1ª ronda 2ª ronda 3ª ronda 4ª ronda 5ª ronda 6ª ronda 7ª ronda 8ª ronda 9ª ronda Resultados individuales Orden de fuerzas 2012 1ª Ronda ˆˆ subir 2ª Ronda ˆˆ subir 3ª Ronda ˆˆ subir 4ª Ronda ˆˆ subir 5ª Ronda ˆˆ subir 6ª Ronda ˆˆ subir 7ª Ronda ˆˆ subir 8ª Ronda ˆˆ subir 9ª Ronda ˆˆ subir

C1: 1 | D1: 2 | E1: 3 | F1: 4 | G1: 5 | H1: 6 | I1: 7 | J1: 8 | K1: 9 | L1: 10 | M1: Puntos
A2: 1 | B2: San Juan | D2: 3 | E2: 0.5 | F2: 3 | G2: 4 | H2: 3 | I2: 2 | J2: 2 | K2: 2,5 | L2: 3 | M2: =SUM(C5:L5) -> 13.5
A3: 2 | B3: Fomento | C3: 1 | E3: 0.5 | F3: 2,5 | G3: 1.5 | H3: 2,5 | I3: 1 | J3: 1,5 | K3: 1,5 | L3: 2.5 | M3: =SUM(C6:L6) -> 8.5
A4: 3 | B4: Oberena | C4: 3.5 | D4: 3.5 | F4: 0,5 | G4: 3 | H4: 3,5 | I4: 0,5 | J4: 3.5 | K4: 3.5 | L4: 0,5 | M4: =SUM(C7:L7) -> 11
A5: 4 | B5: Orvina B | C5: 1 | D5: 1,5 | E5: 3,5 | G5: 3,5 | H5: 2,5 | I5: 1.5 | J5: 2 | K5: 1 | L5: 2 | M5: =SUM(C8:L8) -> 11.5
A6: 5 | B6: Ruta B | C6: 0 | D6: 2.5 | E6: 1 | F6: 0,5 | H6: 3.5 | I6: 0,5 | J6: 2.5 | K6: 3.5 | L6: 1 | M6: =SUM(C9:L9) -> 10,5
A7: 6 | B7: Barakaldo | C7: 1 | D7: 1,5 | E7: 0,5 | F7: 1,5 | G7: 0.5 | I7: 0 | J7: 0.5 | K7: 2 | L7: 1.5 | M7: =SUM(C10:L10) -> 6.5
A8: 7 | B8: Sestao B | C8: 2 | D8: 3 | E8: 3,5 | F8: 2.5 | G8: 3,5 | H8: 4 | J8: 2.5 | K8: 2.5 | L8: 0.5 | M8: =SUM(C11:L11) -> 27,5
A9: 8 | B9: Zornotza | C9: 2 | D9: 2,5 | E9: 0.5 | F9: 2 | G9: 1.5 | H9: 3.5 | I9: 1.5 | K9: 4 | L9: 2 | M9: =SUM(C12:L12) -> 21,5
A10: 9 | B10: Arlutz | C10: 1,5 | D10: 2,5 | E10: 0.5 | F10: 3 | G10: 0.5 | H10: 2 | I10: 1.5 | J10: 0 | L10: 3 | M10: =SUM(C13:L13) -> 7.5
A11: 10 | B11: Urnieta | C11: 1 | D11: 1.5 | E11: 3,5 | F11: 2 | G11: 3 | H11: 2.5 | I11: 3.5 | J11: 2 | K11: 1 | M11: =SUM(C14:L14) -> 14.5

A1: 1ª Jornada (14-1-2012)
A2: San Juan | B2: 3 | C2: 1 | D2: Urnieta
A3: Fomento | B3: 1,5 | C3: 2,5 | D3: Arlutz
A4: Oberena | B4: 1 | C4: 3 | D4: Zornotza
A5: Orvina B | B5: 1 | C5: 3 | D5: Sestao B
A6: (*)Barakaldo | B6: 1 | C6: 3 | D6: Ruta B

A1: 2ª Jornada (21-1-2012)
A2: Urnieta | B2: 3 | C2: 1 | D2: Barakaldo
A3: (*)Ruta B | B3: 0,5 | C3: 3,5 | D3: Sestao B
A4: Zornotza | B4: 2 | C4: 2 | D4: Orvina B
A5: Arlutz | B5: 3 | C5: 1 | D5: Oberena
A6: San Juan | B6: 3 | C6: 1 | D6: Fomento

A1: 3ª Jornada (28-1-2012)
A2: Fomento | B2: 2,5 | C2: 1,5 | D2: Urnieta
A3: Oberena | B3: 0 | C3: 4 | D3: San Juan
A4: Orvina B | B4: 1 | C4: 3 | D4: Arlutz
A5: Ruta B | B5: 2,5 | C5: 1,5 | D5: Zornotza
A6: (*)Sestao B | B6: 4 | C6: 0 | D6: Barakaldo

A1: 4ª Jornada (4-2-2012)
A2: (*)Sestao B | B2: 3.5 | C2: =4-B2 -> 0.5 | D2: Urnieta
A3: (*)Barakaldo | B3: 3.5 | C3: =4-B3 -> 0.5 | D3: Zornotza
A4: Arlutz | B4: 0.5 | C4: =4-B4 -> 3.5 | D4: Ruta B
A5: San Juan | B5: 3 | C5: =4-B5 -> 1 | D5: Orvina B
A6: Fomento | B6: 0.5 | C6: =4-B6 -> 3.5 | D6: Oberena

A1: 5ª Jornada (11-2-2012)
A2: (*)Urnieta | B2: 3,5 | C2: =4-B2 -> 0,5 | D2: Oberena
A3: Orvina B | B3: 1,5 | C3: =4-B3 -> 2,5 | D3: Fomento
A4: Ruta B | B4: 0 | C4: =4-B4 -> 4 | D4: San Juan
A5: Barakaldo | B5: 2 | C5: =4-B5 -> 2 | D5: Arlutz
A6: (*)Zornotza | B6: 2.5 | C6: =4-B6 -> 1.5 | D6: Sestao B

A1: 6ª Jornada (18-2-2012)
A2: (*)Zornotza | B2: 2 | C2: =4-B2 -> 2 | D2: Urnieta
A3: Arlutz | B3: 1.5 | C3: =4-B3 -> 2.5 | D3: Sestao B
A4: San Juan | B4: 3 | C4: =4-B4 -> 1 | D4: Barakaldo
A5: Fomento | B5: 1.5 | C5: =4-B5 -> 2.5 | D5: Ruta B
A6: Oberena | B6: 0,5 | C6: =4-B6 -> 3,5 | D6: Orvina B

A1: 7ª Jornada (25-2-2012)
A2: (*)Urnieta | B2: 2 | C2: =4-Q59 -> 2 | D2: Orvina B
A3: Ruta B | B3: 1 | C3: =4-Q60 -> 3 | D3: Oberena
A4: Barakaldo | B4: 1,5 | C4: =4-Q61 -> 2,5 | D4: Fomento
A5: Sestao B | B5: 2 | C5: =4-Q62 -> 2 | D5: San Juan
A6: (*)Arlutz | B6: 0 | C6: =4-Q63 -> 4 | D6: Zornotza

A1: 8ª Jornada (3-3-2012)
A2: Urnieta | B2: 1 | C2: =4-Q66 -> 3 | D2: Arlutz
A3: (*)Zornotza | B3: 2 | C3: =4-Q67 -> 2 | D3: San Juan
A4: Sestao B | B4: 3 | C4: =4-Q68 -> 1 | D4: Fomento
A5: Oberena | B5: 3,5 | C5: =4-Q69 -> 0,5 | D5: Barakaldo
A6: Orvina B | B6: 3,5 | C6: =4-Q70 -> 0,5 | D6: Ruta B

A1: 9ª Jornada (10-3-2012)
A2: Ruta B | B2: 1 | C2: =4-Q73 -> 3 | D2: Urnieta
A3: Barakaldo | B3: 1,5 | C3: =4-Q74 -> 2,5 | D3: Orvina B
A4: Oberena | B4: 0,5 | C4: =4-Q75 -> 3,5 | D4: Sestao B
A5: Fomento | B5: 1,5 | C5: =4-Q76 -> 2,5 | D5: Zornotza
A6: San Juan | B6: 2,5 | C6: =4-Q77 -> 1,5 | D6: Arlutz

A1: euskara | B1: contacto - localización