A1: Club de Ajedrez Agustin de Leiza Agustin de Leiza Xake Elkartea

B1: Equipos | C1: 1 | D1: 2 | E1: 3 | F1: 4 | G1: 5 | H1: 6 | I1: 7 | J1: 8 | K1: 9 | L1: 10 | M1: Puntos
A2: 1 | B2: San Viator | D2: 3½ | E2: 4 | F2: 2 | G2: 4 | H2: 1½ | I2: 3½ | L2: 2
A3: 2 | B3: Zuri-Baltza | C3: ½ | E3: 2 | F3: 1 | G3: 1½ | H3: 1½ | K3: ½ | L3: 3
A4: 3 | B4: Santa Ana | C4: 0 | D4: 2 | F4: 2 | G4: 1½ | J4: ½ | K4: ½ | L4: 2
A5: 4 | B5: Conteneo | C5: 2 | D5: 3 | E5: 2 | I5: 2 | J5: 1½ | K5: 2 | L5: 2
A6: 5 | B6: Urnieta | C6: 0 | D6: 2½ | E6: 2½ | H6: 1 | I6: 2½ | J6: 2 | K6: 1½
A7: 6 | B7: Oberena | C7: 2½ | D7: 2½ | G7: 3 | I7: 2½ | J7: 2 | K7: 3 | L7: 2½
A8: 7 | B8: Portugalete | C8: ½ | F8: 2 | G8: 1½ | H8: 1½ | J8: 2 | K8: ½ | L8: 2½
A9: 8 | B9: Gros B | E9: 3½ | F9: 2½ | G9: 2 | H9: 2 | I9: 2 | K9: ½ | L9: 3½
A10: 9 | B10: Abadiño | D10: 3½ | E10: 3½ | F10: 2 | G10: 2½ | H10: 1 | I10: 3½ | J10: 3½
A11: 10 | B11: Orvina B | C11: 2 | D11: 1 | E11: 2 | F11: 2 | H11: 1½ | I11: 1½ | J11: ½

A1: 1ª Jornada (11-01-2020)
A2: Orvina B | B2: 2 | C2: 2 | D2: San Viator
A3: Zuri-Baltza | B3: ½ | C3: 3½ | D3: Abadiño
A4: Santa Ana | B4: ½ | C4: 3½ | D4: Gros B
A5: Conteneo | B5: 2 | C5: 2 | D5: Portugalete
A6: Urnieta | B6: 1 | C6: 3 | D6: Oberena

A1: 2ª Jornada (18-01-2020)
A2: Oberena | B2: 2½ | C2: 1½ | D2: Orvina B
A3: Portugalete | B3: 1½ | C3: 2½ | D3: Urnieta
A4: Gros B | B4: 2½ | C4: 1½ | D4: Conteneo
A5: Abadiño | B5: 3½ | C5: ½ | D5: Santa Ana
A6: San Viator | B6: 3½ | C6: ½ | D6: Zuri-Baltza

A1: 3ª Jornada (25-01-2020)
A2: Orvina B | B2: 1 | C2: 3 | D2: Zuri-Baltza
A3: Santa Ana | B3: 0 | C3: 4 | D3: San Viator
A4: Conteneo | B4: 2 | C4: 2 | D4: Abadiño
A5: Urnieta | B5: 2 | C5: 2 | D5: Gros B
A6: Oberena | B6: 2½ | C6: 1½ | D6: Portugalete

A1: 4ª Jornada (01-02-2020)
A2: Portugalete | B2: 3.5 | C2: =4-B2 -> 0.5 | D2: Orvina B
A3: Gros B | B3: 3.5 | C3: =4-B3 -> 0.5 | D3: Oberena
A4: Abadiño | B4: 0.5 | C4: =4-B4 -> 3.5 | D4: Urnieta
A5: San Viator | B5: 2 | C5: =4-B5 -> 2 | D5: Conteneo
A6: Zuri-Baltza | B6: 0.5 | C6: =4-B6 -> 3.5 | D6: Santa Ana

A1: 5ª Jornada (08-02-2020)
A2: Orvina B | B2: 2 | C2: =4-B2 -> 2 | D2: Santa Ana
A3: Conteneo | B3: 3 | C3: =4-B3 -> 1 | D3: Zuri-Baltza
A4: Urnieta | B4: 4 | C4: =4-B4 -> 0 | D4: San Viator
A5: Oberena | B5: 3 | C5: =4-B5 -> 1 | D5: Abadiño
A6: Portugalete | B6: 2.5 | C6: =4-B6 -> 1.5 | D6: Gros B

A1: 6ª Jornada (15-02-2020)
A2: Gros B | B2: 3½ | C2: =4-B2 -> ½ | D2: Orvina B
A3: Abadiño | B3: 1.5 | C3: =4-B3 -> 2.5 | D3: Portugalete
A4: San Viator | B4: 1½ | C4: =4-B4 -> 2½ | D4: Oberena
A5: Zuri-Baltza | B5: 1.5 | C5: =4-B5 -> 2.5 | D5: Urnieta
A6: Santa Ana | B6: 2 | C6: =4-B6 -> 2 | D6: Conteneo

A1: 7ª Jornada (22-02-2020)
A2: Orvina B | B2: 2 | C2: =4-Q59 -> 2 | D2: Conteneo
A3: Urnieta | B3: 2½ | C3: =4-Q60 -> 1½ | D3: Santa Ana
A4: Oberena | B4: 2½ | C4: =4-Q61 -> 1½ | D4: Zuri-Baltza
A5: Portugalete | B5: ½ | C5: =4-Q62 -> 3½ | D5: San Viator
A6: Gros B | B6: ½ | C6: =4-Q63 -> 3½ | D6: Abadiño

A1: 8ª Jornada (29-02-2020)
A2: Abadiño | C2: =4-Q66 ->  | D2: Orvina B
A3: San Viator | C3: =4-Q67 ->  | D3: Gros B
A4: Zuri-Baltza | C4: =4-Q68 ->  | D4: Portugalete
A5: Santa Ana | C5: =4-Q69 ->  | D5: Oberena
A6: Conteneo | C6: =4-Q70 ->  | D6: Urnieta

A1: 9ª Jornada (07-03-2020)
A2: Orvina B | C2: =4-Q73 ->  | D2: Urnieta
A3: Oberena | C3: =4-Q74 ->  | D3: Conteneo
A4: Portugalete | C4: =4-Q75 ->  | D4: Santa Ana
A5: Gros B | C5: =4-Q76 ->  | D5: Zuri-Baltza
A6: Abadiño | C6: =4-Q77 ->  | D6: San Viator

A1: euskera | B1: Blog - contacto - localización