A1: Agustin de Leitza Xake Elkartea

A1: » hasiera » elkarteko bazkideak » taldekako txapelketa » azken txapelketak » loturak | B1: 2009 Euskadiko Txapelketa 1. Maila horri nagusira itzuli Egutegia 1. ihardunaldia 2. ihardunaldia 3. ihardunaldia 4. ihardunaldia 5. ihardunaldia 6. ihardunaldia 7. ihardunaldia 8. ihardunaldia 9. ihardunaldia Bakarko emaitzak Indarren zerrenda 2009 2005 denboraldia 2006 denboraldia 2008 denboraldia 1. ihardunaldia ˆˆ gora 2. ihardunaldia ˆˆ gora 3. ihardunaldia ˆˆ gora 4. ihardunaldia ˆˆ gora 5. ihardunaldia ˆˆ gora 6. ihardunaldia ˆˆ gora 7. ihardunaldia ˆˆ gora 8. ihardunalida ˆˆ gora 9. ihardunaldia ˆˆ gora

D9: 1 | E9: 2 | F9: 3 | G9: 4 | H9: 5 | I9: 6 | J9: 7 | K9: 8 | L9: 9 | M9: 10 | N9: Puntuak
B10: 1 | C10: Egidazu | E10: 1 | F10: 0.5 | G10: ½ | H10: 1 | I10: 4 | J10: 2 | K10: 1½ | L10: 0 | M10: 0 | N10: =SUM(C5:L5) -> 13.5
B11: 2 | C11: Orvina B | D11: 3 | F11: 0.5 | G11: 1½ | H11: 1.5 | I11: 3 | J11: 3½ | K11: 3 | L11: 1½ | M11: 2.5 | N11: =SUM(C6:L6) -> 8.5
B12: 3 | C12: Urnieta | D12: 3.5 | E12: 3.5 | G12: 2½ | H12: 1½ | I12: 1½ | J12: 2 | K12: 3.5 | L12: 3.5 | M12: 1 | N12: =SUM(C7:L7) -> 16½
B13: 4 | C13: Arlutz | D13: 3½ | E13: 2½ | F13: 1½ | H13: 2 | I13: 1 | J13: 1.5 | K13: 3 | L13: 2½ | M13: 1½ | N13: =SUM(C8:L8) -> 11.5
B14: 5 | C14: Abadiño | D14: 3 | E14: 2.5 | F14: 2½ | G14: 2 | I14: 3.5 | J14: 1½ | K14: 2.5 | L14: 3.5 | M14: 1 | N14: =SUM(C9:L9) -> 16½
B15: 6 | C15: Easo | D15: 0 | E15: 1 | F15: 2½ | G15: 3 | H15: 0.5 | J15: 2 | K15: 0.5 | L15: 2½ | M15: 1.5 | N15: =SUM(C10:L10) -> 6.5
B16: 7 | C16: Zarauz | D16: 2 | E16: ½ | F16: 2 | G16: 2.5 | H16: 2½ | I16: 2 | K16: 2.5 | L16: 2.5 | M16: 0.5 | N16: =SUM(C11:L11) -> 13½
B17: 8 | C17: Gros B | D17: 2½ | E17: 1 | F17: 0.5 | G17: 1 | H17: 1.5 | I17: 3.5 | J17: 1.5 | L17: 2½ | M17: 2½ | N17: =SUM(C12:L12) -> 16
B18: 9 | C18: Sestao B | D18: 4 | E18: 2½ | F18: 0.5 | G18: 1½ | H18: 0.5 | I18: 1½ | J18: 1.5 | K18: 1½ | M18: 3 | N18: =SUM(C13:L13) -> 7.5
B19: 10 | C19: Oberena | D19: 4 | E19: 1.5 | F19: 3 | G19: 2½ | H19: 3 | I19: 2.5 | J19: 3.5 | K19: 1½ | L19: 1 | N19: =SUM(C14:L14) -> 14.5

A1: 1. ihardunaldia (2009-1-10)
A2: Egidazu | B2: 0 | C2: 4 | D2: Oberena
A3: Orvina B | B3: 1½ | C3: 2½ | D3: Sestao B
A4: Urnieta | B4: 2½ | C4: 1½ | D4: Gros B
A5: Arlutz | B5: 2½ | C5: 1½ | D5: Zarauz
A6: Easo | B6: 2½ | C6: 1½ | D6: Abadiño

A1: 2. ihardunaldia (2009-1-17)
A2: Oberena | B2: 1 | C2: 3 | D2: Easo
A3: Abadiño | B3: 1½ | C3: 2½ | D3: Zarauz
A4: Gros B | B4: 1 | C4: 3 | D4: Arlutz
A5: Sestao B | B5: 2½ | C5: 1½ | D5: Urnieta
A6: Egidazu | B6: 1 | C6: 3 | D6: Orvina B

A1: 3. ihardunaldia (2009-1-31)
A2: Orvina B | B2: ½ | C2: 3½ | D2: Oberena
A3: Urnieta | B3: 3 | C3: 1 | D3: Egidazu
A4: Arlutz | B4: 2½ | C4: 1½ | D4: Sestao B
A5: Abadiño | B5: 3 | C5: 1 | D5: Gros B
A6: Zarauz | B6: 2 | C6: 2 | D6: Easo

A1: 4. ihardunaldia (2009-2-07)
A2: Zarauz | B2: 3.5 | C2: =4-B2 -> 0.5 | D2: Oberena
A3: Easo | B3: 3.5 | C3: =4-B3 -> 0.5 | D3: Gros B
A4: Sestao B | B4: 0.5 | C4: =4-B4 -> 3.5 | D4: Abadiño
A5: Egidazu | B5: ½ | C5: =4-B5 -> 3½ | D5: Arlutz
A6: Orvina B | B6: 0.5 | C6: =4-B6 -> 3.5 | D6: Urnieta

A1: 5. ihardunaldia (2009-2-14)
A2: Oberena | B2: 3 | C2: =4-B2 -> 1 | D2: Urnieta
A3: Arlutz | B3: 2½ | C3: =4-B3 -> 1½ | D3: Orvina B
A4: Abadiño | B4: 3 | C4: =4-B4 -> 1 | D4: Egidazu
A5: Easo | B5: 2½ | C5: =4-B5 -> 1½ | D5: Sestao B
A6: Gros B | B6: 2.5 | C6: =4-B6 -> 1.5 | D6: Zarauz

A1: 6. ihardunaldia (2009-2-21)
A2: Gros B | B2: 2½ | C2: =4-B2 -> 1½ | D2: Oberena
A3: Sestao B | B3: 1.5 | C3: =4-B3 -> 2.5 | D3: Zarauz
A4: Egidazu | B4: 4 | C4: =4-B4 -> 0 | D4: Easo
A5: Orvina B | B5: 1.5 | C5: =4-B5 -> 2.5 | D5: Abadiño
A6: Urnieta | B6: 2½ | C6: =4-B6 -> 1½ | D6: Arlutz

A1: 7. ihardunaldia (2009-2-28)
A2: Oberena | B2: 2½ | C2: =4-Q59 -> 1½ | D2: Arlutz
A3: Abadiño | B3: 2½ | C3: =4-Q60 -> 1½ | D3: Urnieta
A4: Easo | B4: 1 | C4: =4-Q61 -> 3 | D4: Orvina B
A5: Zarauz | B5: 2 | C5: =4-Q62 -> 2 | D5: Egidazu
A6: Sestao B | B6: 1½ | C6: =4-Q63 -> 2½ | D6: Gros B

A1: 8. ihardunaldia (2009-3-7)
A2: Oberena | B2: 1 | C2: =4-Q66 -> 3 | D2: Sestao B
A3: Gros B | B3: 2½ | C3: =4-Q67 -> 1½ | D3: Egidazu
A4: Zarauz | B4: ½ | C4: =4-Q68 -> 3½ | D4: Orvina B
A5: Urnieta | B5: 1½ | C5: =4-Q69 -> 2½ | D5: Easo
A6: Arlutz | B6: 2 | C6: =4-Q70 -> 2 | D6: Abadiño

A1: 9. ihardunaldia (2009-3-14)
A2: Abadiño | B2: 1 | C2: =4-Q73 -> 3 | D2: Oberena
A3: Easo | B3: 3 | C3: =4-Q74 -> 1 | D3: Arlutz
A4: Urnieta | B4: 2 | C4: =4-Q75 -> 2 | D4: Zarauz
A5: Orvina B | B5: 3 | C5: =4-Q76 -> 1 | D5: Gros B
A6: Egidazu | B6: 0 | C6: =4-Q77 -> 4 | D6: Sestao B

A1: castellano | B1: harremana - kokapena