A1: Club de Ajedrez Agustín de Leiza

A1: » inicio » socios del club » cto. por equipos » últimos torneos » enlaces | B1: Liga Vasca 1ª División 2014 volver a página principal Calendario 1ª ronda 2ª ronda 3ª ronda 4ª ronda 5ª ronda 6ª ronda 7ª ronda 8ª ronda 9ª ronda Resultados individuales Orden de fuerzas 2014 1ª Ronda ˆˆ subir 2ª Ronda ˆˆ subir 3ª Ronda ˆˆ subir 4ª Ronda ˆˆ subir 5ª Ronda ˆˆ subir 6ª Ronda ˆˆ subir 7ª Ronda ˆˆ subir 8ª Ronda ˆˆ subir 9ª Ronda ˆˆ subir (*) Se juega fuera pero con los colores de casa.

C4: 1 | D4: 2 | E4: 3 | F4: 4 | G4: 5 | H4: 6 | I4: 7 | J4: 8 | K4: 9 | L4: 10 | M4: Puntos
A5: 1 | B5: Urnieta | D5: 1 | E5: 0.5 | F5: 2 | G5: 3 | H5: 3 | I5: 2 | J5: 2 | K5: 1½ | L5: 2½ | M5: =SUM(C5:L5) -> 13.5
A6: 2 | B6: Zornotza | C6: 3 | E6: 0.5 | F6: 2 | G6: 1.5 | H6: ½ | I6: 3 | J6: 3 | K6: ½ | L6: 2.5 | M6: =SUM(C6:L6) -> 8.5
A7: 3 | B7: San Juan B | C7: 3.5 | D7: 3.5 | F7: 1 | G7: 2½ | H7: ½ | I7: 2 | J7: 3.5 | K7: 3.5 | L7: 1 | M7: =SUM(C7:L7) -> 12½
A8: 4 | B8: Fomento | C8: 2 | D8: 2 | E8: 3 | G8: 1½ | H8: 1½ | I8: 1.5 | J8: 1½ | K8: ½ | L8: 2½ | M8: =SUM(C8:L8) -> 11.5
A9: 5 | B9: Rey Ardid | C9: 1 | D9: 2.5 | E9: 1½ | F9: 2½ | H9: 3.5 | I9: 1 | J9: 2.5 | K9: 3.5 | L9: 2 | M9: =SUM(C9:L9) -> 13½
A10: 6 | B10: Sestao B | C10: 1 | D10: 3½ | E10: 3½ | F10: 2½ | G10: 0.5 | I10: 3 | J10: 0.5 | K10: 2½ | L10: 1.5 | M10: =SUM(C10:L10) -> 6.5
A11: 7 | B11: Orvina B | C11: 2 | D11: 1 | E11: 2 | F11: 2.5 | G11: 3 | H11: 1 | J11: 2.5 | K11: 2.5 | L11: 0.5 | M11: =SUM(C11:L11) -> 16
A12: 8 | B12: Egidazu | C12: 2 | D12: 1 | E12: 0.5 | F12: 2½ | G12: 1.5 | H12: 3.5 | I12: 1.5 | K12: 1 | L12: 1½ | M12: =SUM(C12:L12) -> 14
A13: 9 | B13: Abadiño | C13: 2½ | D13: 3½ | E13: 0.5 | F13: 3½ | G13: 0.5 | H13: 1½ | I13: 1.5 | J13: 3 | L13: 1½ | M13: =SUM(C13:L13) -> 7.5
A14: 10 | B14: Calasanz | C14: 1½ | D14: 1.5 | E14: 3 | F14: 1½ | G14: 2 | H14: 2.5 | I14: 3.5 | J14: 2½ | K14: 2½ | M14: =SUM(C14:L14) -> 14.5

A1: 1ª Jornada (11-1-2014)
A2: (*)Urnieta | B2: 2½ | C2: 1½ | D2: Calasanz
A3: Zornotza | B3: ½ | C3: 3½ | D3: Abadiño
A4: San Juan B | B4: 3 | C4: 1 | D4: Egidazu
A5: Fomento | B5: 2 | C5: 2 | D5: Orvina B
A6: Sestao B | B6: 2 | C6: 2 | D6: Rey Ardid

A1: 2ª Jornada (18-1-2014)
A2: (*)Calasanz | B2: 3½ | C2: ½ | D2: Sestao B
A3: Orvina B | B3: 3 | C3: 1 | D3: Rey Ardid
A4: Egidazu | B4: 2½ | C4: 1½ | D4: Fomento
A5: Abadiño | B5: 3½ | C5: ½ | D5: San Juan B
A6: Urnieta | B6: 1 | C6: 3 | D6: Zornotza

A1: 3ª Jornada (25-1-2014)
A2: (*)Zornotza | B2: 3 | C2: 1 | D2: Calasanz
A3: San Juan B | B3: ½ | C3: 3½ | D3: Urnieta
A4: Fomento | B4: ½ | C4: 3½ | D4: Abadiño
A5: Rey Ardid | B5: 2 | C5: 2 | D5: Egidazu
A6: Sestao B | B6: 3 | C6: 1 | D6: Orvina B

A1: 4ª Jornada (1-2-2014)
A2: (*)Calasanz | B2: 3.5 | C2: =4-B2 -> 0.5 | D2: Orvina B
A3: Egidazu | B3: 3.5 | C3: =4-B3 -> 0.5 | D3: Sestao B
A4: Abadiño | B4: 0.5 | C4: =4-B4 -> 3.5 | D4: Rey Ardid
A5: Urnieta | B5: 2 | C5: =4-B5 -> 2 | D5: Fomento
A6: Zornotza | B6: 0.5 | C6: =4-B6 -> 3.5 | D6: San Juan B

A1: 5ª Jornada (8-2-2014)
A2: (*)San Juan B | B2: 3 | C2: =4-B2 -> 1 | D2: Calasanz
A3: Fomento | B3: 2 | C3: =4-B3 -> 2 | D3: Zornotza
A4: Rey Ardid | B4: 1 | C4: =4-B4 -> 3 | D4: Urnieta
A5: Sestao B | B5: 2½ | C5: =4-B5 -> 1½ | D5: Abadiño
A6: Orvina B | B6: 2.5 | C6: =4-B6 -> 1.5 | D6: Egidazu

A1: 6ª Jornada (15-2-2014)
A2: (*)Calasanz | B2: 2½ | C2: =4-B2 -> 1½ | D2: Egidazu
A3: Abadiño | B3: 1.5 | C3: =4-B3 -> 2.5 | D3: Orvina B
A4: Urnieta | B4: 3 | C4: =4-B4 -> 1 | D4: Sestao B
A5: Zornotza | B5: 1.5 | C5: =4-B5 -> 2.5 | D5: Rey Ardid
A6: San Juan B | B6: 1 | C6: =4-B6 -> 3 | D6: Fomento

A1: 7ª Jornada (22-2-2014)
A2: (*)Fomento | B2: 2½ | C2: =4-Q59 -> 1½ | D2: Calasanz
A3: Rey Ardid | B3: 1½ | C3: =4-Q60 -> 2½ | D3: San Juan B
A4: Sestao B | B4: 3½ | C4: =4-Q61 -> ½ | D4: Zornotza
A5: Orvina B | B5: 2 | C5: =4-Q62 -> 2 | D5: Urnieta
A6: Egidazu | B6: 1 | C6: =4-Q63 -> 3 | D6: Abadiño

A1: 8ª Jornada (1-3-2014)
A2: (*)Calasanz | B2: 2½ | C2: =4-Q66 -> 1½ | D2: Abadiño
A3: Urnieta | B3: 2 | C3: =4-Q67 -> 2 | D3: Egidazu
A4: Zornotza | B4: 3 | C4: =4-Q68 -> 1 | D4: Orvina B
A5: San Juan B | B5: ½ | C5: =4-Q69 -> 3½ | D5: Sestao B
A6: Fomento | B6: 1½ | C6: =4-Q70 -> 2½ | D6: Rey Ardid

A1: 9ª Jornada (8-3-2014)
A2: Rey Ardid | B2: 2 | C2: =4-Q73 -> 2 | D2: Calasanz
A3: Sestao B | B3: 2½ | C3: =4-Q74 -> 1½ | D3: Fomento
A4: Orvina B | B4: 2 | C4: =4-Q75 -> 2 | D4: San Juan B
A5: Egidazu | B5: 1 | C5: =4-Q76 -> 3 | D5: Zornotza
A6: Abadiño | B6: 2½ | C6: =4-Q77 -> 1½ | D6: Urnieta

A1: euskara | B1: contacto - localización