A1: Club de Ajedrez Agustín de Leiza

A1: » inicio » socios del club » cto. por equipos » últimos torneos » enlaces | B1: Liga Vasca 1a División 2008 El resultado del encuentro Gros B-Eguzki es debido al 0-0 de la partida Martiarena-Tung. El equipo de Larrasoloeta tiene -2 por su incoparecencia ante Fomento. volver a página principal Calendario 1a ronda 2a ronda 3a ronda 4a ronda 5a ronda 6a ronda 7a ronda 8a ronda 9a ronda Resultados individuales Orden de fuerzas 2008 Temporada 2005 Temporada 2006 1a Ronda ˆˆ subir 2a Ronda ¿Victoria en Gros? Quizás A falta de la crónica de nuestro enviado especial aquí va una pequeña crónica de lo acontecido en Gros. Por una vez no llegamos tarde al encuentro, lo primero que nos impactó fue el ambiente, ya que los habituales equipos de Gros y Easo se sumaba el de Fortuna ya que tenía sus instalaciones cerradas por la festividad del santo de la ciudad, la segunda cosa fuera de lo normal que aconteció fué el minuto de silencio guardado en la memoria de Robert J. Fischer. Empezaron las partidas y en mitad de ellas ocurrió el incidente de la jornada, le sonó el móvil a Eneko, el dichoso estaba apagado pero el jugador del equipo de Urnieta no había reparado en que sí estaba puesta la alarma, y es lo que sonó. Reclamación del jugador de Gros y llamada al tele-árbitro, después de muchos dimes y diretes el árbitro dice que se continúe el juego, que acabó con victoria de Eneko con ataque de mate y la posterior reclamación al comité de competición de Gros. Ya veremos en qué acaba todo esto, ya que hay precedentes para el caso de los dos equipos. En el resto de tableros no ocurrió nada fuera de lo normal, en el primer tablero Iosu jugó estilo Aritz y perdió el solito, fue la primera partida en acabar. En el segundo tablero el capi se reencontraba con el tablero después de muchos meses y se notó. Entro en una variante de la Benoni que le aseguraba un juego tranquilo, al final se encontró con una posición peor y sacrificando calidades, se llegó a un final muy complicado donde el negro tenía chances de victoria sacrificando una torre pero no lo hizo y se llegó a un final de tablas. Por último en el tercer tablero Claudio ganó gracias a la presencia hipnótica de Javi ya que el contrario se ensimismó en la posición hasta que se le cayó la bandera, Javi para esto de las banderas caídas no tiene precio. En la posición final quizás sea Claudio el que tenga ventaja después de una partida muy movida en la que pudo pasar cualquier cosa. Ahora a espensas de lo que diga el comité de competición. ˆˆ subir 3a Ronda ˆˆ subir 4a Ronda S Arriba las manos Urnieta 2½ – Mikel Gurea 1½ Los ladrones del tren de Glasgow, conocido universalmente como el robo del siglo, eran unos auténticos aficionados si los comparamos con los jugadores del equipo de Urnieta. ¡Menudo atraco el que hemos presenciado esta tarde y que ha tenido como víctima al recién ascendido equipo navarro! Lo que debería haber sido una contundente y merecida derrota, ha desembocado finalmente en una increíble victoria por la mínima del equipo local. ¡Menuda forma de lograr la primera victoria en lo que va de campeonato (a falta de resolver el punto pendiente del encuentro en segunda ronda frente a Gros) Los jugadores de Urnieta han demostrado saber cada vez menos de ajedrez, pero, eso sí, han sacado a relucir todo un repertorio de trucos dignos de verdaderos tahúres. Y eso que el rival de hoy parecía el idóneo para sumar una buena cantidad de puntos. Su clasificación, sus resultados, el ELO de sus componentes..., todo eran motivos para pensar que hoy nos íbamos a zampar a nuestro contrincante, pero por poco sufrimos una indigestión y nos quedamos con el amargo sabor de una oportunidad perdida. Corral 1 – Irañeta 0 Primera victoria que se anota Javi en su casillero particular. Pero aparte del resultado no hay demasiados motivos para echar cohetes. La partida no pasará precisamente a la historia por su excelencia técnica. Extraña apertura del negro, que mueve rápidamente su alfil de casillas blancas. Javi hostiga al intruso y consigue enterrarlo en vida. Sus peones hacen la función de clavos del ataúd y puede decirse que el atrevido alfil negro tiene menos futuro que la momia de Tutankamon. Todo parece indicar una cómoda victoria para nuestro primer tablero. Pero la partida se adentra en una fase extraña. Juego de maniobras incomprensible para el espectador y apuros de tiempo mutuos. La posición blanca sigue siendo superior pero en la lotería de los apuros puede pasar de todo. Y es lo que pasa. Javi se come un peón envenenado y su rival reacciona peligrosamente. A partir de ahí se da un intercambio constante de errores. Parece una especie de duelo: “si tú la cagas, yo más”. Afortunadamente para nosotros, el joven jugador navarro parece empeñado en plantar un buen pino y siembra de cagadas todo el tablero. El hedor se hace insoportable y antes de que las moscas terminen con los allí presentes, el negro opta por abandonar. Sabia decisión. Razkin 1 – Aguirre 0 Este chaval tiene problemas. Y serios, muy serios. Ya no se trata solamente de que esté jugando fatal o de que siempre se apure de reloj. Es que encima le ocurren cosas extrañísimas. Pero bueno, no anticipemos los acontecimientos. Alucinante apertura del blanco, digna de un jugador que empieza a mover las piezas (dicho con todo el respeto del mundo). Iosu se muestra confiado, mueve con inusual rapidez y piensa en una fácil victoria. Pero de repente algo se tuerce. El blanco empieza a jugar como Dios manda y a Iosu se le empieza a nublar la mente. No ve ningún plan convincente y pasa a jugar lento y mal. Rematadamente mal. Tan mal que cae en una difícil posición. Y encima sin tiempo. Menos mal que su rival tampoco es un genio y le perdona la vida varias veces. Así que lo peor parece haber pasado. Llegamos al momento decisivo: jugada 39 del negro. Dispone de un minuto y quince segundos en su reloj. Iosu evalúa las diferentes jugadas y mueve su torre. La posición queda completamente igualada, las tablas se acercan a marchas forzadas. Mover su torre le ha llevado un minuto, por lo que realiza su último movimiento con diecisiete segundos en el reloj. Bueno, eso es lo que él cree, porque nada más mover su torre y apretar el reloj, vuelve a concentrarse en el tablero. Pero...¡su tiempo sigue corriendo! No ha debido accionar bien el botón y la cuenta atrás sigue su marcha inexorable: 17, 16, 15... ¡¡Y Iosu no se entera!! La única persona que es consciente del drama es su compañero de equipo Claudio, que pasaba por ahí a ver las partidas. Asiste impotente al espectáculo y reprime el grito de “¡¡Por Dios, trata de mirar al reloj, Iosu, trata de mirarlo!! Pero es inútil. Ya no hay nada que hacer. Sólo cuando su tiempo se ha agotado, Iosu se digna a echar una ojeada al reloj, y sólo es capaz de exclamar: “¡Ostia tú, que se me ha caído la bandera!” Se hace el silencio, y su rival profiere un misericordioso: “Lo siento tío, yo tampoco me he dado cuenta”. Sus compañeros de equipo, acostumbrados a este tipo de fenómenos paranormales, se limitan a encogerse de hombros y menear la cabeza. Dejamos a la imaginación del lector pensar qué es lo que pueda haber pasado por sus cabezas en esos momentos. Manso ½ – Mancha ½ Parece que Félix se está especializando en salvar partidas que no las salva ni Tarzán. Porque hoy, igual que en segunda ronda frente a Gros, nadie daba un céntimo por su posición. Apenas terminada la apertura las cosas han comenzado a torcerse. Y a medida que pasaban las jugadas la posición no hacía sino empeorar. Su posición era calamitosa: peor estructura de peones, alfil malo, peón de menos...Una auténtica ruina; vamos, que estaba perdido como una rata. Pero, milagros de la vida, su rival no ha sido capaz de rematar la partida -mira que era fácil- y de repente, como por arte de birlibirloque, su alfil patatero, que era un auténtico cadáver, empieza a encontrar espacios. Su rey se pone farruco y amenaza con irrumpir en la retaguardia enemiga. La partida da semejante vuelco que ¡Félix aspira a ganar! Pero bueno, por el propio bien del ajedrez, para que no terminemos pensando que aquí vale todo, el jugador navarro ha sido capaz de sobreponerse y de conseguir tablas. Sólo queda preguntarse una cosa: ¿Dónde está el Félix que conocemos? ¿Qué queda de ese jugador de estilo tan clásico y ortodoxo? ¿Se nos ha convertido en un vulgar trucker ? García 0 – Martiarena 1 Con esta partida se han roto todas las marcas. Si había algún record que batir, Eneko se ha encargado de mandarlo a mejor vida. Así como Ludwig van Beethoven compuso una “Oda a la Alegría”, podemos asegurar -sin temor a equivocarnos- que la partida de hoy podría titularse algo así como “Oda a la Infamia”. Iosu, que para eso de encontrar expresiones graciosas tiene cierto ingenio, la ha catalogado como partida estilo Ganbara (a los profanos en la materia les hacemos saber que el Ganbara es uno de los bares de la zona de copas de Andoain). Sólo ha faltado que ambos jugadores tuvieran su copita de pacharán para darle al encuentro un tono más entrañable. Prometemos solemnemente no estar exagerando un ápice. La apertura ha sido de juzgado de guardia, el medio juego -con Eneko avanzando los peones de su enroque de forma suicida- digno de una película de serie zeta, y el final bordeando lo friki. De verdad, algo indescriptible. El rival de Eneko ha podido ganar de mil maneras diferentes, pero se ha empeñado en darle emoción al asunto. La secuencia final de la película ha tenido su lado futbolístico: el tiqui taca pero aplicado al ajedrez: Jaque, tiqui, peón que me como, taca; otro jaque, tiqui, otro peón pa la saca , taca; jaquecito por aquí, tiqui, peoncito por allá, taca. Y así hasta que el blanco se ha quedado sin peones, sin torres y sin nada. ¡Hala, a firmar debajo del cero! Partida basura pero, oye, ha sido divertido eso del tiqui taca. ¿Qué más cabe decir? ˆˆ subir 5a Ronda Un pasito pa'lante ... Larrasoloeta 1 – Urnieta 3 Después del relativo fiasco de la semana pasada (no pudimos pasar de un modesto -y gracias- 2½ a 1½ frente al teóricamente débil equipo de Mikel Gurea), el encuentro a disputar este sábado en Durango frente al equipo de Larrasoloeta se presentaba casi casi decisivo. El equipo rival había realizado un torneo prácticamente idéntico al nuestro, jugando contra los mismos rivales que nosotros y aventajándonos en medio punto. Por lo tanto, el equipo que se hiciera con la victoria podría dejar tocado psicológicamente a su rival además de tener la ventaja en el average particular en caso de empate (que vista la igualdad imperante no es un factor insustancial ). El equipo que íbamos a presentar estaba decidido desde hace una semana, y al igual que los galácticos del Real Madrid, hemos seguido con las rotaciones. De esta forma, los cinco componentes del equipo han jugado 4 partidas y descansado una. También el medio de transporte estaba decidido. Después de las peripecias del viaje a Bilbao de la primera ronda, Iosu había dejado bien clara su negativa a coger el coche durante una larga temporada (“prefiero ir a dedo que en mi coche”). Por lo tanto, no quedaba más remedio que Félix volviera a ponerse al volante y nos deleitara con su técnica automovilística. Y todo ello en su flamante nuevo bólido. En estas condiciones, el equipo de Urnieta tomó la A-8 dirección Durango, siendo conscientes todos de la gran trascendencia del resultado del encuentro. ¿Cómo se han desarrollado las partidas? Diego Sarralde 1 – Javier Corral 0 Ante el esquema ultradefensivo planteado por el blanco, Javi no tiene excesivos problemas para igualar. Por desgracia, consume un tiempo precioso mientras que su rival mueve a un ritmo vertiginoso. El medio juego sigue por los mismos derroteros: juego rápido e insulso del blanco y consumo de tiempo y más tiempo por parte de Jota, empeñado en encontrar un plan que le permitiera lograr ventaja. Y de esta manera llega el momento decisivo: la posición ha evolucionado de tal forma que el blanco ha de tratar de movilizar su mayoría en el flanco de dama y Javi tratar de imponer su mayor presencia en el flanco de rey. Espadas en todo lo alto. La partida promete....Pero lo que no entraba en los cálculos de nadie era una garrafal error de Javo que le deja con pieza de menos y sin el menor contrajuego. Enfadado consigo mismo, alarga la agonía unas pocas jugadas más pero finalmente cede a la evidencia y abandona. Lástima de partida. Iosu Aguirre 1 – Sabino Arauzo 0 Vistosa partida la desarrollada en el segundo tablero. Iosu elige un agresivo gambito para combatir el esquema defensivo del negro. Apenas transcurren unas pocas jugadas y ya nos encontramos ante una posición virgen, no jugada anteriormente. Iosu consume toneladas y toneladas de tiempo y no tarda en llegar a un apuro de reloj terrible. En esas circunstancias, el sentido común recomienda mover rápido y sencillo. Pero no, Iosu se enfunda el traje de jugador romántico, gasta sus últimos minutos y se mete de lleno en un galimatías inenarrable. Sacrifica una, dos, tres piezas, y llega un momento en el que prácticamente todas sus piezas están amenazadas. A cambio dispone de un ataque fortísimo contra un rey negro atrapado en el centro del tablero. ¿Quién se impondrá? ¿La ventaja bruta de material y tiempo del negro o el espíritu romántico de un Iosu desconocido? Sus compañeros de equipo no creen que Iosu disponga del tiempo necesario para calcular la infinidad de variantes posibles, pero el segundo tablero urnietarra, bregado en cientos –por no decir miles- de apuros de reloj similares, se mueve como pez en el agua en la maraña de complicaciones y consigue rematar la partida en bonito estilo. Luego le lloverán las recriminaciones: “Jó tío, te pasas cuatro pueblos con el reloj”, “Paso de mirar tus partidas, me pones de los nervios”...Y él a todos les dice que sí, que tienen razón, pero en el fondo está feliz. Ya tiene partida para enseñar a todo el mundo durante una larga temporada. Jesús Unzueta 0 – Félix Manso 1 A la cuarta fue la vencida y por fin ha podido celebrar Félix su primera victoria en lo que va de torneo. Pero para ello ha tenido que sufrir lo indecible, pasar por posiciones de lo más sospechosas y aprovechar implacablemente los errores del rival. Y eso que la apertura no presagiaba demasiados problemas para nuestro capitán. Pasivo juego del blanco y Félix iguala sin dificultades. Ambos jugadores se adentran en la fase maniobrera de la partida y la tormenta estalla en el tablero cuando el blanco opta por abrir el centro. Félix contraataca y aparentemente logra ventaja, pero sólo aparentemente, porque el blanco deja escapar una variante que hubiera dejado prácticamente KO al negro (por fortuna esta variante no aparecerá en el tablero hasta la hora del análisis post mortem). La partida pasa por una fase tremendamente complicada, con jugadas únicas por ambas partes, y es Félix quien mejor aguanta la presión y termina por llevarse el gato al agua. ¡Buff, qué nervios! Claudio Mendikute 1 – Iñaki Lombraña 0 ¡Vaya, vaya con nuestro fichaje estrella! Espléndida victoria de Claudio en el más puro estilo karpoviano, haciendo las delicias de los aficionados al arte de las pequeñas ventajas. El apesadumbrado capitán del equipo de Andoain, Don Aritz Rabadán, hubiera llorado de alegría al ver esta partida. Ha sido un clásico ejemplo de cómo ir incrementando la ventaja poco a poco hasta alcanzar la victoria. El blanco sale de la apertura con ligera ventaja, logra la pareja de alfiles, mayoría de peones en el flanco de dama, control de la única columna abierta... Vamos, de manual. Y encima sin apurarse de reloj. Y, para más inri, acaba rematando con un elegante sacrificio de calidad. El negro no tiene más remedio que abandonar y felicitar a Claudio por su juego. Ahora cabe preguntarse: ¿Tenemos un nuevo pretendiente a primer tablero? ¿Qué ambiciones esconde Claudio? ¿Exigirá dinero por seguir jugando con nosotros? Mientras se van despejando las incógnitas sólo cabe felicitarse por el fichaje que hemos hecho y desearle al chaval que vaya por el mismo camino. Por lo tanto, un 3-1 a nuestro favor, resultado que podemos considerar justo y acorde con lo visto en los tableros. Conseguimos resarcirnos del mal gusto de boca que nos dejó el encuentro de la semana pasada y alejarnos un poco de la zona peligrosa de la clasificación. Los más optimistas hablan ya incluso de poder ascender. Pero tranquilos, poco a poco (hacemos nuestras las palabras que pronunciara el Señor Lobo en la película Pulp Fiction, pero por respeto a nuestra joven audiencia omitimos transcribirlas). Sábado a sábado. Lo de hoy no has sido más que eso: un pasito nada más, un pasito pa´lante . Próxima cita: Fomento. Todo un clásico. Ya veremos qué pasa. ˆˆ subir 6a Ronda ...un pasito pa'tras Fomento 2½ – Urnieta 1½ ¡Ah, qué poco dura la alegría en casa del pobre! Basta que los más optimistas del equipo empezaran a hablar de un hipotético ascenso para que el encuentro frente a Fomento nos haga bajar a todos a la dura realidad y convencernos de que hoy por hoy lo único en lo que tenemos que pensar es en salvarnos de la quema del descenso. Los encuentros contra el equipo de Rentería empiezan a tomar la naturaleza de clásico, y es que en la memoria de todos han quedado grabados, entre otros, la histórica derrota que les endosamos en nuestra primera intervención en la categoría de honor de Liga Vasca en la ya lejana temporada 2002-03, así como el estrepitoso fracaso de un año después, cuando nos enchufaron un 4-0, y, cómo no, el dramático encuentro en la última ronda de la temporada 2004-05 que se saldó con 2-2 y que conllevó nuestra despedida de la máxima categoría del ajedrez vasco. Por lo tanto, los encuentros con Fomento -club del cual admiramos su historial y categoría de sus jugadores- tienen para nosotros un sabor especial, encuentros que suelen estar presididos por la máxima rivalidad deportiva y también algún que otro incidente (provocado más que nada por el fragor de la batalla). El encuentro de esta temporada reunía todos los ingredientes para que volviera a darse una tensa y emocionante batalla en el tablero, y, la verdad, a pesar del adverso resultado, creemos que la tarde ha respondido a las expectativas. Viernes, 22:30 horas, víspera del encuentro. Como ya viene siendo costumbre desde hace más de veinte años, los componentes de los equipos de Andoain y Urnieta se reúnen en las instalaciones de la Sociedad Agustín de Leiza. Ha de decidirse la alineación y en principio todos los jugadores están disponibles. ¿Se producirán enfrentamientos para conseguir uno de los puestos que dan derecho a jugar mañana? No, la sangre no llega al río porque muy pronto el capitán del equipo, Félix, aclara que él prefiere descansar. Ha tenido una dura semana de trabajo y mañana también curra por la mañana. Sus compañeros de equipo ven razonable su argumentación y la alineación queda decidida. Será el mismo equipo que disputó la primera ronda en Bilbao frente a Rey Ardid. Una vez zanjada esta cuestión, queda analizar al rival. Comprobando las diferentes alineaciones que han ido presentando en lo que va de temporada y dada la trascendencia del encuentro, no hay prácticamente dudas: seguro que nos presentan al equipo más fuerte (JJ – Agirretxe – Hugo y un cuarto tablero que puede ser Aitor González o Alvarado -pocas horas más tarde comprobaremos que nuestras dotes adivinatorias nada tienen que envidiar a las de la pitonisa Lola-). A falta de una preparación estrictamente deportiva, preferimos definir una serie de directrices generales acerca de cómo encarar las partidas: 1º) Javi y Iosu: fundamental controlar el reloj. No cabe ninguna duda de que sus rivales van a jugar contra esta debilidad de nuestros dos primeros tableros, así que ¡moved rapidito, y no os compliquéis la vida! 2º) Eneko: para empezar, ¡apaga el puto móvil! (así, con esas duras pero justificadas palabras) y luego juega tranquilo, pausado, no te vuelvas loco ni hagas cosas raras. 3º) Claudio: sigue en tu línea, chaval. Directrices un tanto básicas, pero que vienen a hacer hincapié en los aspectos fundamentales a observar en la partida. Eso era lo que decía la teoría, pero ¿y la práctica?, ¿Qué tal aplicaron la teoría nuestros chicos en el ejercicio práctico? Veámoslo J.J. Sáez 1 – Javier Corral 0 Por primera vez en décadas hemos asistido a una partida de Javi en la que no ha sufrido el agobio de las manecillas del reloj (bueno, eso era antes). ¡Pero a qué precio! Nuestro primer espada ha estado irreconocible y ha jugado una de las peores partidas que le recordamos. Ya su tercer movimiento ha sido muy dudoso por no decir malo. A Iosu se le salían los ojos de las órbitas al ver el esquema elegido por su compañero. ¿Cómo se le ocurre adoptar un esquema que no ha jugado en su vida, del cual no conoce los matices y que le viene como anillo al dedo al estilo de su rival? Catastrófico, un auténtico suicidio. Pero eso sí, jugando rapidito. Decisiones que en otras ocasiones le hubieran llevado una eternidad, hoy las ha tomado casi al toque. Un auténtico vaquero, el nuevo Lucky Luke, más rápido que su sombra. Pero sólo ha resultado eso: una auténtica sombra del verdadero Javi. Iosu Aguirre 0 – Txus Agirretxe 1 Así como Javi se llevaba bien aprendida la lección de controlar el tiempo (eso sí, dejándose sin estudiar el resto del temario), Iosu no traía hechos los deberes de casa y no ha podido evitar caer en los apuros de siempre. Ante un rival que movía a un ritmo muy vivo y que daba muestras de conocer bien la posición, Iosu se ha visto obligado a consumir un tiempo precioso para captar las sutilezas de la posición y ser capaz de elaborar un plan activo para el blanco. Al final lo ha conseguido, pero a un costo desorbitado. Cuando han comenzado las hostilidades su rival le sacaba más de una hora de reloj. Una ventaja preciosa que le ha permitido al negro disponer de más tiempo para valorar una compleja situación. Luego, ha llegado el frenesí, con una gran cantidad de errores mutuos (Fritz desmoraliza a cualquiera), pero Txus tenía el tiempo suficiente para cometer únicamente el penúltimo error, ya que Iosu se ha encargado de cometer el último. Cuando juegas siempre al límite lo normal es que termines estrellándote contra el suelo, y eso es lo que ha pasado. Los apuros le han hecho ver a Iosu una alucinación y hacia ella se ha dirigido como un sonámbulo. Al final tortazo que te crió y suspendido para Septiembre. Hugo Álvarez ½ – Claudio Mendikute 0.5 Claudio ha seguido en la misma tónica de todo el torneo y no ha tenido ningún problema para igualar rápidamente con las piezas negras. Era evidente que a no ser de que algo raro pasara, la partida iba terminar en unas pacíficas tablas. El medio juego ha presenciado tímidos e infructuosos intentos por ambos bandos por hacerse con la iniciativa, pero finalmente todo ha terminado con el lógico reparto del punto. Buen resultado de Claudio, que está dando muestras de una gran solidez y que junto a Eneko está siendo el pilar del equipo. Sobresaliente. Eneko Martiarena 1 – Mikel Alvarado 0 Ha tenido que transcurrir más de media liga para que por fin hayamos podido ver al Eneko que más nos gusta y que esperamos juegue lo que queda de competición igual de bien que hoy. Ahuyentado el fantasma del teléfono móvil, sólo nos quedaba la duda de saber si Eneko había asimilado bien las palabras de ayer: “juega tranquilo, sin locuras ni cosas raras...” Por lo que parece la sesión de hipnosis tuvo su efecto y hemos asistido a la mejor partida de Eneko en lo que va de Liga. Atrás ha quedado ese estilo cafetero que tanto desasosiego genera a sus compañeros y Eneko nos ha deleitado con un juego enérgico y creativo, que le ha permitido obtener una clara ventaja en la apertura y no dar tregua a su rival. Además, la tan temida precipitación no ha hecho acto de presencia y antes de acometer la embestida final ha asegurado su posición con una serie de buenas jugadas profilácticas que han eliminado de raíz cualquier posibilidad de contrajuego de su rival. Buena partida de Eneko y un puntito más para su casillero. Notable alto. Visto lo visto, un resultado justo y un toque de atención que nos obliga a poner los pies en la tierra y centrarnos en la lucha por la permanencia. Encaramos el último tercio de liga y cualquier fallo puede resultar fatal, así que despacito y con buena letra. Próxima estación Orvina, un rival temible que nos obligará a dejarnos la piel en el tablero. Hasta entonces un saludo. ˆˆ subir 7a Ronda ˆˆ subir 8a Ronda ˆˆ subir 9a Ronda ˆˆ subir

A3: 1 | B3: 2 | C3: 3 | D3: 4 | E3: 5 | F3: 6 | G3: 7 | H3: 8 | I3: 9 | J3: 10 | K3: Puntos
4: 1 | 4: Orvina B | B4: 3½ | C4: 0.5 | D4: 1½ | E4: 1 | F4: 3½ | G4: ½ | H4: 1 | I4: 2 | J4: 2½ | K4: =SUM(C5:L5) -> 13.5
5: 2 | 5: Ruta de Europa B | A5: ½ | C5: 0.5 | D5: 1½ | E5: 1.5 | F5: 1½ | G5: 1 | H5: ½ | I5: ½ | J5: 2.5 | K5: =SUM(C6:L6) -> 8.5
6: 3 | 6: Barakaldo | A6: 3.5 | B6: 3.5 | D6: ½ | E6: 2½ | F6: 2 | G6: 4 | H6: 3.5 | I6: 3.5 | J6: 3½ | K6: =SUM(C7:L7) -> 19
7: 4 | 7: Rey Ardid | A7: 2½ | B7: 2½ | C7: 3½ | E7: 1½ | F7: 2 | G7: 1.5 | H7: 2½ | I7: 3 | J7: 1½ | K7: =SUM(C8:L8) -> 11.5
8: 5 | 8: Gros B | A8: 3 | B8: 2.5 | C8: 1½ | D8: 2½ | F8: 3.5 | G8: 1½ | H8: 2.5 | I8: 3.5 | J8: 2 | K8: =SUM(C9:L9) -> 18½
9: 6 | 9: Oberena | A9: ½ | B9: 2½ | C9: 2 | D9: 2 | E9: 0.5 | G9: 2 | H9: 0.5 | I9: 1½ | J9: 1.5 | K9: =SUM(C10:L10) -> 6.5
10: 7 | 10: Eguzki Urnieta | A10: 3½ | B10: 3 | C10: 0 | D10: 2.5 | E10: 1½ | F10: 2 | H10: 2.5 | I10: 2.5 | J10: 0.5 | K10: =SUM(C11:L11) -> 18½
11: 8 | 11: Lasarroloeta | A11: 3 | B11: 3½ | C11: 0.5 | D11: 1½ | E11: 1.5 | F11: 3.5 | G11: 1.5 | I11: 0 | J11: 1½ | K11: =SUM(C12:L12) -> 15
12: 9 | 12: Fomento Cultural | A12: 2 | B12: 3½ | C12: 0.5 | D12: 1 | E12: 0.5 | F12: 2½ | G12: 1.5 | H12: 4 | J12: 3½ | K12: =SUM(C13:L13) -> 7.5
13: 10 | 13: Mikel Gurea | A13: 1½ | B13: 1.5 | C13: ½ | D13: 2½ | E13: 2 | F13: 2.5 | G13: 3.5 | H13: 2½ | I13: ½ | K13: =SUM(C14:L14) -> 14.5

A1: 1a Jornada (12-1-2008)
A2: Orvina B | B2: 2½ | C2: 1½ | D2: Mikel Gurea
A3: Ruta de Europa B | B3: ½ | C3: 3½ | D3: Fomento
A4: Barakaldo | B4: 2 | C4: 2 | D4: Larrasoloeta
A5: Rey Ardid | B5: 2½ | C5: 1½ | D5: Urnieta
A6: Oberena | B6: 2 | C6: 2 | D6: Gros B

A1: 2a Jornada (19-1-2008)
A2: Mikel Gurea | B2: ½ | C2: 3½ | D2: Oberena
A3: Gros B | B3: 1½ | C3: 1½ | D3: Urnieta
A4: Larrasoloeta | B4: 1½ | C4: 2½ | D4: Rey Ardid
A5: Fomento | B5: 3½ | C5: ½ | D5: Barakaldo
A6: Orvina B | B6: 3½ | C6: ½ | D6: Ruta de Europa B

A1: 3a Jornada (26-1-2008)
A2: Ruta de Europa B | B2: 2 | C2: 2 | D2: Mikel Gurea
A3: Barakaldo | B3: ½ | C3: 3½ | D3: Orvina B
A4: Rey Ardid | B4: 3 | C4: 1 | D4: Fomento
A5: Gros B | B5: 1½ | C5: 2½ | D5: Larrasoloeta
A6: Urnieta | B6: 2 | C6: 2 | D6: Oberena

A1: 4a Jornada (2-2-2008)
A2: Urnieta | B2: 3.5 | C2: =4-B2 -> 0.5 | D2: Mikel Gurea
A3: Oberena | B3: 3.5 | C3: =4-B3 -> 0.5 | D3: Larrasoloeta
A4: Fomento | B4: 0.5 | C4: =4-B4 -> 3.5 | D4: Gros B
A5: Orvina B | B5: 1½ | C5: =4-B5 -> 2½ | D5: Rey Ardid
A6: Ruta de Europa B | B6: 0.5 | C6: =4-B6 -> 3.5 | D6: Barakaldo

A1: 5a Jornada (9-2-2008)
A2: Mikel Gurea | B2: ½ | C2: =4-B2 -> 3½ | D2: Barakaldo
A3: Rey Ardid | B3: 2½ | C3: =4-B3 -> 1½ | D3: Ruta de Europa B
A4: Gros B | B4: 3 | C4: =4-B4 -> 1 | D4: Orvina B
A5: Oberena | B5: 1½ | C5: =4-B5 -> 2½ | D5: Fomento
A6: Larrasoloeta | B6: 2.5 | C6: =4-B6 -> 1.5 | D6: Urnieta

A1: 6a Jornada (16-2-2008)
A2: Larrasoloeta | B2: 1½ | C2: =4-B2 -> 2½ | D2: Mikel Gurea
A3: Fomento | B3: 1.5 | C3: =4-B3 -> 2.5 | D3: Urnieta
A4: Orvina B | B4: 3½ | C4: =4-B4 -> ½ | D4: Oberena
A5: Ruta de Europa B | B5: 1.5 | C5: =4-B5 -> 2.5 | D5: Gros B
A6: Barakaldo | B6: ½ | C6: =4-B6 -> 3½ | D6: Rey Ardid

A1: 7a Jornada (23-2-2008)
A2: Mikel Gurea | B2: 2½ | C2: =4-Q59 -> 1½ | D2: Rey Ardid
A3: Gros B | B3: 1½ | C3: =4-Q60 -> 2½ | D3: Barakaldo
A4: Oberena | B4: 2½ | C4: =4-Q61 -> 1½ | D4: Ruta de Europa B
A5: Urnieta | B5: 3½ | C5: =4-Q62 -> ½ | D5: Orvina B
A6: Fomento | B6: 4 | C6: =4-Q63 -> 0 | D6: Larrasoloeta

A1: 8a Jornada (1-3-2008)
A2: Mikel Gurea | B2: ½ | C2: =4-Q66 -> 3½ | D2: Fomento
A3: Larrasoloeta | B3: 3 | C3: =4-Q67 -> 1 | D3: Orvina B
A4: Urnieta | B4: 3 | C4: =4-Q68 -> 1 | D4: Ruta de Europa B
A5: Barakaldo | B5: 2 | C5: =4-Q69 -> 2 | D5: Oberena
A6: Rey Ardid | B6: 1½ | C6: =4-Q70 -> 2½ | D6: Gros B

A1: 9a Jornada (8-3-2008)
A2: Gros B | B2: 2 | C2: =4-Q73 -> 2 | D2: Mikel Gurea
A3: Oberena | B3: 2 | C3: =4-Q74 -> 2 | D3: Rey Ardid
A4: Barakaldo | B4: 4 | C4: =4-Q75 -> 0 | D4: Urnieta
A5: Ruta de Europa B | B5: ½ | C5: =4-Q76 -> 3½ | D5: Larrasoloeta
A6: Orvina B | B6: 2 | C6: =4-Q77 -> 2 | D6: Fomento

A1: euskara | B1: contacto - localización