A1: Agustin de Leitza Xake Elkartea

A1: » hasiera » elkarteko bazkideak » taldekako txapelketa » azken txapelketak » loturak | B1: Euskadiko Txapelketa Ohorezko Maila horri nagusira itzuli Egutegia 1. ihardunaldia 2. ihardunaldia 3. ihardunaldia 4. ihardunaldia 5. ihardunaldia 6. ihardunaldia 7. ihardunaldia 8. ihardunaldia 9. ihardunaldia Bakarko emaitzak (PDF) 1. ihardunaldia Urnietako mutilek pundu erdi bat lortu zuten faborito den taldearen aurka, Gros Xake Taldea, Javier Corral-ek MF Elvis Hernández-en aurka lortutako berdinketari esker. Félix Mansok, Iosu Aguirrek eta Miguel Ángel Porterok galdu zuten beren leihaketak Santi Gonzálezen, Franciso Gallegozen eta Ivan Muñozen aurka. Txandako ezustekabea Arlutz eman du Rey Ardid irabasten (1,5-2,5). ˆˆ gora 2. ihardunaldia Ihardunaldi honetan bilboko Rey Ardid-en aurka jokatzen zuten urnietakoek. Rey Ardid txapeldun gurako ohia, beren honenetako bi jokalariak galdu dituzte, GM Mario Gomez eta Jesus Iruzubieta. Emaitza berdinketa izan da, Felix-ek eta Iosu-k galdu dute (azken hau, lekukoak diotenez araberan aupako ostiarekin), Javi-k eta Portero-k irabasi dute beren partidak. ˆˆ gora 3. ihardunaldia Urnietakoek jokatu dute gaur Batalla talde indartsuaren aurka eta oso ohoretzu ematiza lortu dute minimaz galduz. José, Iosu eta Javi-k berdindu dute eta Feliz galdu du. Beste emaitz buruz aipagarriena da Gros garaipen handia Orvina aurka, emaitz hau lehen tokian jartzen zaie abantaila haundiarekin. ˆˆ gora 4. ihardunaldia Ihardun bikoitza Urnieta taldearentzat, larunbatean erabateko garaipena Calasanz aurka, Iosu, Portero eta Godoy irabazi zuten, eta Javi berdindu zuen, eta igandean aurreratu dute Arlutz aurkaren lehia, eta minimaz galdu dute, Felix eta Javi galdu dute, Iosu berdindu eta Portero irabazi du. ˆˆ gora 5. ihardunaldia Gaur geratzen ziren partidak jokatu dira. Nabarmen dezakegu Rey Ardid eta Fomento arteko emaitza, garaipen handia bilbotarrentzat. ˆˆ gora 6. ihardunaldia Porrota aste honetan Urnieta talderako azken orduko Iosuren baja ondoren. 4-0 gogorra eta emaitz honek komplikatzen die maila honetan egoteko lehia zeren orain Fomento pundu erdira baita. ˆˆ gora 7. ihardunaldia Larunbata oso ona Urnietako taldearentzat, irabazi dute aurkari zuzen bati. Felixek eta Iosuk berdindu dute beren partidak eta Porterok eta Javik irabazi dute. ˆˆ gora 8. ihardunalida Galdu dute Urnietako taldekoek Orvinaren aurka. Felixek galdu du Unai Garbisuren aurka, Iosuk berdindu du bere partida, Javik irabasi du eta Josek galdu du bere partida irabazita zegoen posizio batean, mate eman diezaion utzi zuen. Egoera larrian daude orian Urnietakoek, 3-1 irabazi behar dute Fomentoren aurka, edo itxaron Rey Ardid gal dezaten margen handiagoarekin Calasanz aurka. ˆˆ gora 9. ihardunaldia Berdindu dute Urnietako taldea Fomentoren aurka, emaitza hau lehen mailara eramaten zaie. Felixek eta Porterok galdu zuten bere partidak, azken honek posizioa behartu eta gero. Iosuk eta Javi irabazi zuten beren partidak. Txapelketa Grosek irabazi du abaintaila handiarekin, 8 puntu. ˆˆ gora

B-2: 1 | C-2: 2 | D-2: 3 | E-2: 4 | F-2: 5 | G-2: 6 | H-2: 7 | I-2: 8 | J-2: 9 | K-2: 10 | L-2: Puntuak
-1: 1 | A-1: Orvina A | C-1: 3 | D-1: 0.5 | E-1: 3 | F-1: 2 | G-1: 3 | H-1: 2 | I-1: 2,5 | J-1: 2 | K-1: 2 | L-1: =SUM(C5:L5) -> 13.5
0: 2 | A0: F. Cultural | B0: 1 | D0: 0.5 | E0: 1 | F0: 1.5 | G0: 3,5 | H0: 3 | I0: 2 | J0: 2 | K0: 2.5 | L0: =SUM(C6:L6) -> 8.5
1: 3 | A1: Gros X.T. A | B1: 3.5 | C1: 3.5 | E1: 3 | F1: 3,5 | G1: 4 | H1: 3,5 | I1: 3.5 | J1: 3.5 | K1: 3 | L1: =SUM(C7:L7) -> 31
2: 4 | A2: R. Ardid A | B2: 1 | C2: 3 | D2: 1 | F2: 0,5 | G2: 2,5 | H2: 1.5 | I2: 2 | J2: 3 | K2: 1,5 | L2: =SUM(C8:L8) -> 11.5
3: 5 | A3: Batalla | B3: 2 | C3: 2.5 | D3: 0,5 | E3: 3,5 | G3: 3.5 | H3: 2 | I3: 2.5 | J3: 3.5 | K3: 3 | L3: =SUM(C9:L9) -> 23
4: 6 | A4: Calasanz | B4: 1 | C4: 0,5 | D4: 0 | E4: 1,5 | F4: 0.5 | H4: 1 | I4: 0.5 | J4: 2 | K4: 1.5 | L4: =SUM(C10:L10) -> 6.5
5: 7 | A5: Arlutz | B5: 2 | C5: 1 | D5: 0,5 | E5: 2.5 | F5: 2 | G5: 3 | I5: 2.5 | J5: 2.5 | K5: 0.5 | L5: =SUM(C11:L11) -> 16,5
6: 8 | A6: Eguzki Urnieta | B6: 1,5 | C6: 2 | D6: 0.5 | E6: 2 | F6: 1.5 | G6: 3.5 | H6: 1.5 | J6: 3 | K6: 0 | L6: =SUM(C12:L12) -> 15,5
7: 9 | A7: Arrasate/S. Andres | B7: 2 | C7: 2 | D7: 0.5 | E7: 1 | F7: 0.5 | G7: 2 | H7: 1.5 | I7: 1 | K7: 1,5 | L7: =SUM(C13:L13) -> 7.5
8: 10 | A8: Ruta de Europa | B8: 2 | C8: 1.5 | D8: 1 | E8: 2,5 | F8: 1 | G8: 2.5 | H8: 3.5 | I8: 4 | J8: 2,5 | L8: =SUM(C14:L14) -> 14.5

A1: 1. ihardunaldia (2005-01-15)
A2: Orvina | B2: 2 | C2: 2 | D2: Ruta de Europa
A3: F. Cultural/B. Bera | B3: 2 | C3: 2 | D3: Arrasate
A4: Gros A | B4: 3,5 | C4: 0,5 | D4: Urnieta
A5: Rey Ardid A | B5: 1,5 | C5: 2,5 | D5: Arlutz
A6: Batalla | B6: 3,5 | C6: 0,5 | D6: Calasanz

A1: 2. ihardunaldia (2005-01-22)
A2: Ruta de Europa | B2: 2,5 | C2: 1,5 | D2: Calasanz
A3: Arlutz | B3: 2 | C3: 2 | D3: Batalla
A4: Urnieta | B4: 2 | C4: 2 | D4: Rey Ardid A
A5: Arrasate | B5: 0,5 | C5: 3,5 | D5: Gros A
A6: Orvina | B6: 3 | C6: 1 | D6: F. Cultural/B. Bera

A1: 3. ihardunaldia (2005-01-29)
A2: F. Cultural/B. Bera | B2: 2,5 | C2: 1,5 | D2: Ruta de Europa
A3: Gros A | B3: 3,5 | C3: 0,5 | D3: Orvina
A4: Rey Ardid A | B4: 3 | C4: 1 | D4: Arrasate
A5: Batalla | B5: 2,5 | C5: 1,5 | D5: Urnieta
A6: Calasanz | B6: 1 | C6: 3 | D6: Arlutz

A1: 4. ihardunaldia (2005-02-05)
A2: Ruta de Europa | B2: 3.5 | C2: =4-B2 -> 0.5 | D2: Arlutz
A3: Urnieta | B3: 3.5 | C3: =4-B3 -> 0.5 | D3: Calasanz
A4: Arrasate | B4: 0.5 | C4: =4-B4 -> 3.5 | D4: Batalla
A5: Orvina | B5: 3 | C5: =4-B5 -> 1 | D5: Rey Ardid A
A6: F. Cultural/B. Bera | B6: 0.5 | C6: =4-B6 -> 3.5 | D6: Gros A

A1: 5. ihardunaldia (2005-02-12)
A2: Gros A | B2: 3 | C2: =4-B2 -> 1 | D2: Ruta de Europa
A3: Rey Ardid A | B3: 3 | C3: =4-B3 -> 1 | D3: F. Cultural/B. Bera
A4: Batalla | B4: 2 | C4: =4-B4 -> 2 | D4: Orvina
A5: Calasanz | B5: 2 | C5: =4-B5 -> 2 | D5: Arrasate
A6: Arlutz | B6: 2.5 | C6: =4-B6 -> 1.5 | D6: Urnieta

A1: 6. ihardunaldia (2005-02-19)
A2: Ruta de Europa | B2: 4 | C2: =4-B2 -> 0 | D2: Urnieta
A3: Arrasate | B3: 1.5 | C3: =4-B3 -> 2.5 | D3: Arlutz
A4: Orvina | B4: 3 | C4: =4-B4 -> 1 | D4: Calasanz
A5: F. Cultural/B. Bera | B5: 1.5 | C5: =4-B5 -> 2.5 | D5: Batalla
A6: Gros A | B6: 3 | C6: =4-B6 -> 1 | D6: Rey Ardid A

A1: 7. ihardunaldia (2005-02-26)
A2: Rey Ardid A | B2: 1,5 | C2: =4-Q59 -> 2,5 | D2: Ruta de Europa
A3: Batalla | B3: 0,5 | C3: =4-Q60 -> 3,5 | D3: Gros A
A4: Calasanz | B4: 0,5 | C4: =4-Q61 -> 3,5 | D4: F. Cultural/B. Bera
A5: Arlutz | B5: 2 | C5: =4-Q62 -> 2 | D5: Orvina
A6: Urnieta | B6: 3 | C6: =4-Q63 -> 1 | D6: Arrasate

A1: 8. ihardunaldia (2005-03-05)
A2: Ruta de Europa | B2: 2,5 | C2: =4-Q66 -> 1,5 | D2: Arrasate
A3: Orvina | B3: 2,5 | C3: =4-Q67 -> 1,5 | D3: Urnieta
A4: F. Cultural/B. Bera | B4: 3 | C4: =4-Q68 -> 1 | D4: Arlutz
A5: Gros A | B5: 4 | C5: =4-Q69 -> 0 | D5: Calasanz
A6: Rey Ardid A | B6: 0,5 | C6: =4-Q70 -> 3,5 | D6: Batalla

A1: 9. ihardunaldia (2005-03-12)
A2: Batalla | B2: 3 | C2: =4-Q73 -> 1 | D2: Ruta de Europa
A3: Calasanz | B3: 1,5 | C3: =4-Q74 -> 2,5 | D3: Rey Ardid A
A4: Arlutz | B4: 0,5 | C4: =4-Q75 -> 3,5 | D4: Gros A
A5: Urnieta | B5: 2 | C5: =4-Q76 -> 2 | D5: F. Cultural/B. Bera
A6: Arrasate | B6: 2 | C6: =4-Q77 -> 2 | D6: Orvina

A1: castellano | B1: harremana - kokapena