A1: Club de Ajedrez Agustín de Leiza

A1: » inicio » socios del club » cto. por equipos » últimos torneos » enlaces | B1: Liga Vasca División de Honor volver a página principal Calendario 1a ronda 2a ronda 3a ronda 4a ronda 5a ronda 6a ronda 7a ronda 8a ronda 9a ronda Resultados individuales 1a Ronda Los chicos de Urnieta arrancaron medio punto a los claros favoritos del torneo, Gros Xake Taldea, gracias a las tablas en el tercer tablero de Javier Corral frente al MF Elvis Hernández. Félix Manso, Iosu Aguirre y Miguel Ángel Portero perdieron frente a Santi González, Francisco Gallego e Ivan Muñoz respectivamente. La sorpresa de la jornada ha sido la derrota de Rey Ardid a manos de Arlutz (1½-2½). ˆˆ subir 2a Ronda Esta jornada jugaban contra el club bilbaíno de Rey Ardid, otrora aspirante al título pero que ha perdido dos de sus mejores exponentes, el GM Mario Gomez y Jesús Iruzubieta. El resultado ha sido de empate a 2, con derrotas de Félix y Iosu (según comentarios de testigos una ostia de aupa) y victorias de Javi y Portero. ˆˆ subir 3a Ronda Los de Urnieta han jugado hoy contra el fuerte equipo Batalla y han conseguido un honroso resultado perdiendo por la mínima. José, Iosu y Javi entablaron y Félix perdió. Del resto de encuentros cabe destacar la abultada victoria de Gros frente a Orvina que les situa en primera posición con un amplio margen. ˆˆ subir 4a Ronda Jornada doble para el equipo de Urnieta, el sabado ganaron contundentemente a Calasanz, con victorias de Iosu, Portero y Godoy, y tablas de Javi, y el domingo han adelantado el enfrentamiento con Arlutz cosechando una derrota por la mínima, con derrotas de Félix y Javi, tablas de Iosu y victoria de Portero. ˆˆ subir 5a Ronda Hoy se ha jugado el resto de la jornada de la que cabe destacar el abultado resultado del encuentro Rey Ardid - Fomento. ˆˆ subir 6a Ronda Derrota esta semana del equipo de Urnieta que se vió mermado por la baja de última hora de Iosu. 4-0 inapelable que les complica la lucha por la salvación ya que Fomento se sitúa a medio punto. ˆˆ subir 7a Ronda Magnífica jornada para el equipo de Urnieta, victoria frente a un rival directo. Félix y Iosu hicieron tablas y ganaron Portero y Javi. ˆˆ subir 8a Ronda Derrota del equipo de Urnieta con derrota de Félix frente a Unai Garbisu, tablas de Iosu, victoria de Corral y derrota de Jose en una posición ganada donde se dejó de dar mate. Esto situa en posición peligrosa al equipo de Urnieta, deben ganar 3-1 al equipo de Fomento o esperar que Rey Ardid pierda por una margen mayor frente a Calasanz. ˆˆ subir 9a Ronda Empate de Urnieta frente a Fomento que les relega al descenso medio punto por detrás de Rey Ardid. Derrotas de Félix y Portero, este último por forzar la posición y victorias de Iosu y Javi. La victoria en el campeonato a sido indidudablemente para Gros con 8 puntos de ventaja. ˆˆ subir

C4: 1 | D4: 2 | E4: 3 | F4: 4 | G4: 5 | H4: 6 | I4: 7 | J4: 8 | K4: 9 | L4: 10 | M4: Puntos
A5: 1 | B5: Orvina A | D5: 3 | E5: 0.5 | F5: 3 | G5: 2 | H5: 3 | I5: 2 | J5: 2½ | K5: 2 | L5: 2 | M5: =SUM(C5:L5) -> 13.5
A6: 2 | B6: F. Cultural | C6: 1 | E6: 0.5 | F6: 1 | G6: 1.5 | H6: 3½ | I6: 3 | J6: 2 | K6: 2 | L6: 2.5 | M6: =SUM(C6:L6) -> 8.5
A7: 3 | B7: Gros X.T. A | C7: 3.5 | D7: 3.5 | F7: 3 | G7: 3½ | H7: 4 | I7: 3½ | J7: 3.5 | K7: 3.5 | L7: 3 | M7: =SUM(C7:L7) -> 31
A8: 4 | B8: R. Ardid A | C8: 1 | D8: 3 | E8: 1 | G8: ½ | H8: 2½ | I8: 1.5 | J8: 2 | K8: 3 | L8: 1½ | M8: =SUM(C8:L8) -> 11.5
A9: 5 | B9: Batalla | C9: 2 | D9: 2.5 | E9: ½ | F9: 3½ | H9: 3.5 | I9: 2 | J9: 2.5 | K9: 3.5 | L9: 3 | M9: =SUM(C9:L9) -> 23
A10: 6 | B10: Calasanz | C10: 1 | D10: ½ | E10: 0 | F10: 1½ | G10: 0.5 | I10: 1 | J10: 0.5 | K10: 2 | L10: 1.5 | M10: =SUM(C10:L10) -> 6.5
A11: 7 | B11: Arlutz | C11: 2 | D11: 1 | E11: ½ | F11: 2.5 | G11: 2 | H11: 3 | J11: 2.5 | K11: 2.5 | L11: 0.5 | M11: =SUM(C11:L11) -> 16½
A12: 8 | B12: Eguzki Urnieta | C12: 1½ | D12: 2 | E12: 0.5 | F12: 2 | G12: 1.5 | H12: 3.5 | I12: 1.5 | K12: 3 | L12: 0 | M12: =SUM(C12:L12) -> 15½
A13: 9 | B13: Arrasate/S. Andres | C13: 2 | D13: 2 | E13: 0.5 | F13: 1 | G13: 0.5 | H13: 2 | I13: 1.5 | J13: 1 | L13: 1½ | M13: =SUM(C13:L13) -> 7.5
A14: 10 | B14: Ruta de Europa | C14: 2 | D14: 1.5 | E14: 1 | F14: 2½ | G14: 1 | H14: 2.5 | I14: 3.5 | J14: 4 | K14: 2½ | M14: =SUM(C14:L14) -> 14.5

A1: 1a Jornada (15-01-2005)
A2: Orvina | B2: 2 | C2: 2 | D2: Ruta de Europa
A3: F. Cultural/B. Bera | B3: 2 | C3: 2 | D3: Arrasate
A4: Gros A | B4: 3½ | C4: ½ | D4: Urnieta
A5: Rey Ardid A | B5: 1½ | C5: 2½ | D5: Arlutz
A6: Batalla | B6: 3½ | C6: ½ | D6: Calasanz

A1: 2a Jornada (22-01-2005)
A2: Ruta de Europa | B2: 2½ | C2: 1½ | D2: Calasanz
A3: Arlutz | B3: 2 | C3: 2 | D3: Batalla
A4: Urnieta | B4: 2 | C4: 2 | D4: Rey Ardid A
A5: Arrasate | B5: ½ | C5: 3½ | D5: Gros A
A6: Orvina | B6: 3 | C6: 1 | D6: F. Cultural/B. Bera

A1: 3a Jornada (29-01-2005)
A2: F. Cultural/B. Bera | B2: 2½ | C2: 1½ | D2: Ruta de Europa
A3: Gros A | B3: 3½ | C3: ½ | D3: Orvina
A4: Rey Ardid A | B4: 3 | C4: 1 | D4: Arrasate
A5: Batalla | B5: 2½ | C5: 1½ | D5: Urnieta
A6: Calasanz | B6: 1 | C6: 3 | D6: Arlutz

A1: 4a Jornada (05-02-2005)
A2: Ruta de Europa | B2: 3.5 | C2: =4-B2 -> 0.5 | D2: Arlutz
A3: Urnieta | B3: 3.5 | C3: =4-B3 -> 0.5 | D3: Calasanz
A4: Arrasate | B4: 0.5 | C4: =4-B4 -> 3.5 | D4: Batalla
A5: Orvina | B5: 3 | C5: =4-B5 -> 1 | D5: Rey Ardid A
A6: F. Cultural/B. Bera | B6: 0.5 | C6: =4-B6 -> 3.5 | D6: Gros A

A1: 5a Jornada (12-02-2005)
A2: Gros A | B2: 3 | C2: =4-B2 -> 1 | D2: Ruta de Europa
A3: Rey Ardid A | B3: 3 | C3: =4-B3 -> 1 | D3: F. Cultural/B. Bera
A4: Batalla | B4: 2 | C4: =4-B4 -> 2 | D4: Orvina
A5: Calasanz | B5: 2 | C5: =4-B5 -> 2 | D5: Arrasate
A6: Arlutz | B6: 2.5 | C6: =4-B6 -> 1.5 | D6: Urnieta

A1: 6a Jornada (19-02-2005)
A2: Ruta de Europa | B2: 4 | C2: =4-B2 -> 0 | D2: Urnieta
A3: Arrasate | B3: 1.5 | C3: =4-B3 -> 2.5 | D3: Arlutz
A4: Orvina | B4: 3 | C4: =4-B4 -> 1 | D4: Calasanz
A5: F. Cultural/B. Bera | B5: 1.5 | C5: =4-B5 -> 2.5 | D5: Batalla
A6: Gros A | B6: 3 | C6: =4-B6 -> 1 | D6: Rey Ardid A

A1: 7a Jornada (26-02-2005)
A2: Rey Ardid A | B2: 1½ | C2: =4-Q59 -> 2½ | D2: Ruta de Europa
A3: Batalla | B3: ½ | C3: =4-Q60 -> 3½ | D3: Gros A
A4: Calasanz | B4: ½ | C4: =4-Q61 -> 3½ | D4: F. Cultural/B. Bera
A5: Arlutz | B5: 2 | C5: =4-Q62 -> 2 | D5: Orvina
A6: Urnieta | B6: 3 | C6: =4-Q63 -> 1 | D6: Arrasate

A1: 8a Jornada (05-03-2005)
A2: Ruta de Europa | B2: 2½ | C2: =4-Q66 -> 1½ | D2: Arrasate
A3: Orvina | B3: 2½ | C3: =4-Q67 -> 1½ | D3: Urnieta
A4: F. Cultural/B. Bera | B4: 3 | C4: =4-Q68 -> 1 | D4: Arlutz
A5: Gros A | B5: 4 | C5: =4-Q69 -> 0 | D5: Calasanz
A6: Rey Ardid A | B6: ½ | C6: =4-Q70 -> 3½ | D6: Batalla

A1: 9a Jornada (12-03-2005)
A2: Batalla | B2: 3 | C2: =4-Q73 -> 1 | D2: Ruta de Europa
A3: Calasanz | B3: 1½ | C3: =4-Q74 -> 2½ | D3: Rey Ardid A
A4: Arlutz | B4: ½ | C4: =4-Q75 -> 3½ | D4: Gros A
A5: Urnieta | B5: 2 | C5: =4-Q76 -> 2 | D5: F. Cultural/B. Bera
A6: Arrasate | B6: 2 | C6: =4-Q77 -> 2 | D6: Orvina

A1: euskara | B1: contacto - localización