A1: Club de Ajedrez Agustin de Leiza Agustin de Leiza Xake Elkartea

B1: Taldeak | C1: 1 | D1: 2 | E1: 3 | F1: 4 | G1: 5 | H1: 6 | I1: 7 | J1: 8 | K1: 9 | L1: 10 | M1: Puntuak
A2: 1 | B2: Abadiño | D2: 3 | E2: 3 | F2: 1½ | G2: 3½ | H2: 2 | I2: 2 | J2: 2½ | K2: 3 | L2: 3 | M2: 23½
A3: 2 | B3: San Juan B | C3: 1 | E3: 1½ | F3: 1½ | G3: 2½ | H3: ½ | I3: 1 | J3: 1 | K3: 1 | L3: ½ | M3: 10½
A4: 3 | B4: Urnieta | C4: 1 | D4: 2½ | F4: 2½ | G4: 2½ | H4: 1 | I4: 1½ | J4: 1½ | K4: 4 | L4: 2 | M4: 18½
A5: 4 | B5: Zornotza | C5: 2½ | D5: 2½ | E5: 1½ | G5: 3 | H5: ½ | I5: 1 | J5: 2½ | K5: 1½ | L5: 1½ | M5: 16½
A6: 5 | B6: Billabona | C6: ½ | D6: 1½ | E6: 1½ | F6: 1 | H6: 2 | I6: 1½ | J6: 1 | K6: 2 | L6: 0 | M6: 11
A7: 6 | B7: Egidazu | C7: 2 | D7: 3½ | E7: 3 | F7: 3½ | G7: 2 | I7: 2½ | J7: 1 | K7: 3½ | L7: 1½ | M7: 22½
A8: 7 | B8: Zuri Baltza | C8: 2 | D8: 3 | E8: 2½ | F8: 3 | G8: 2½ | H8: 1½ | J8: 4 | K8: 3 | L8: 1½ | M8: 23
A9: 8 | B9: Sestao B | C9: 1½ | D9: 3 | E9: 2½ | F9: 1½ | G9: 3 | H9: 3 | I9: 0 | K9: 1 | L9: 2 | M9: 17½
A10: 9 | B10: Barakaldo | C10: 1 | D10: 3 | E10: 0 | F10: 2½ | G10: 2 | H10: ½ | I10: 1 | J10: 3 | L10: 1½ | M10: 14½
A11: 10 | B11: Orvina B | C11: 1 | D11: 3½ | E11: 2 | F11: 2½ | G11: 4 | H11: 2½ | I11: 2½ | J11: 2 | K11: 2½ | M11: 22½

A1: 1. ihardunaldia (2016-01-09)
A2: Orvina B | B2: 1 | C2: 3 | D2: Abadiño
A3: San Juan B | B3: 1 | C3: 3 | D3: Barakaldo
A4: Urnieta | B4: 1½ | C4: 2½ | D4: Sestao B
A5: Zornotza | B5: 1 | C5: 3 | D5: Zuri Baltza
A6: Billabona | B6: 2 | C6: 2 | D6: Egidazu

A1: 2. ihardunaldia (2016-01-16)
A2: Egidazu | B2: 1½ | C2: 2½ | D2: Orvina B
A3: Zuri Baltza | B3: 2½ | C3: 1½ | D3: Billabona
A4: Sestao B | B4: 1½ | C4: 2½ | D4: Zornotza
A5: Barakaldo | B5: 0 | C5: 4 | D5: Urnieta
A6: Abadiño | B6: 3 | C6: 1 | D6: San Juan B

A1: 3. ihardunaldia (2016-01-23)
A2: Orvina B | B2: 3½ | C2: ½ | D2: San Juan B
A3: Urnieta | B3: 1 | C3: 3 | D3: Abadiño
A4: Zornotza | B4: 1½ | C4: 2½ | D4: Barakaldo
A5: Billabona | B5: 1 | C5: 3 | D5: Sestao B
A6: Egidazu | B6: 2½ | C6: 1½ | D6: Zuri Baltza

A1: 4. ihardunaldia (2016-01-30)
A2: Zuri Baltza | B2: 3.5 | C2: =4-B2 -> 0.5 | D2: Orvina B
A3: Sestao B | B3: 3.5 | C3: =4-B3 -> 0.5 | D3: Egidazu
A4: Barakaldo | B4: 0.5 | C4: =4-B4 -> 3.5 | D4: Billabona
A5: Abadiño | B5: 1½ | C5: =4-B5 -> 2½ | D5: Zornotza
A6: San Juan B | B6: 0.5 | C6: =4-B6 -> 3.5 | D6: Urnieta

A1: 5. ihardunaldia (2016-02-06)
A2: Orvina B | B2: 2 | C2: =4-B2 -> 2 | D2: Urnieta
A3: Zornotza | B3: 2½ | C3: =4-B3 -> 1½ | D3: San Juan B
A4: Billabona | B4: ½ | C4: =4-B4 -> 3½ | D4: Abadiño
A5: Egidazu | B5: 3½ | C5: =4-B5 -> ½ | D5: Barakaldo
A6: Zuri Baltza | B6: 2.5 | C6: =4-B6 -> 1.5 | D6: Sestao B

A1: 6. ihardunaldia (2016-02-13)
A2: Sestao B | B2: 2 | C2: =4-B2 -> 2 | D2: Orvina B
A3: Barakaldo | B3: 1.5 | C3: =4-B3 -> 2.5 | D3: Zuri Baltza
A4: Abadiño | B4: 2 | C4: =4-B4 -> 2 | D4: Egidazu
A5: San Juan B | B5: 1.5 | C5: =4-B5 -> 2.5 | D5: Billabona
A6: Urnieta | B6: 2½ | C6: =4-B6 -> 1½ | D6: Zornotza

A1: 7. ihardunaldia (2016-02-20)
A2: Orvina B | B2: 2½ | C2: =4-Q59 -> 1½ | D2: Zornotza
A3: Billabona | B3: 1½ | C3: =4-Q60 -> 2½ | D3: Urnieta
A4: Egidazu | B4: 3½ | C4: =4-Q61 -> ½ | D4: San Juan B
A5: Zuri Baltza | B5: 2 | C5: =4-Q62 -> 2 | D5: Abadiño
A6: Sestao B | B6: 1 | C6: =4-Q63 -> 3 | D6: Barakaldo

A1: 8. ihardunaldia (2016-02-27)
A2: Barakaldo | B2: 1½ | C2: =4-Q66 -> 2½ | D2: Orvina B
A3: Abadiño | B3: 2½ | C3: =4-Q67 -> 1½ | D3: Sestao B
A4: San Juan B | B4: 1 | C4: =4-Q68 -> 3 | D4: Zuri Baltza
A5: Urnieta | B5: 1 | C5: =4-Q69 -> 3 | D5: Egidazu
A6: Zornotza | B6: 3 | C6: =4-Q70 -> 1 | D6: Billabona

A1: 9. ihardunaldia (2016-03-05)
A2: Orvina B | B2: 4 | C2: =4-Q73 -> 0 | D2: Billabona
A3: Egidazu | B3: 3½ | C3: =4-Q74 -> ½ | D3: Zornotza
A4: Zuri Baltza | B4: 2½ | C4: =4-Q75 -> 1½ | D4: Urnieta
A5: Sestao B | B5: 3 | C5: =4-Q76 -> 1 | D5: San Juan B
A6: Barakaldo | B6: 1 | C6: =4-Q77 -> 3 | D6: Abadiño

A1: castellano | B1: Blog - harreman - kokapena