A1: Club de Ajedrez Agustin de Leiza Agustin de Leiza Xake Elkartea

B1: Equipos | C1: 1 | D1: 2 | E1: 3 | F1: 4 | G1: 5 | H1: 6 | I1: 7 | J1: 8 | K1: 9 | L1: 10 | M1: Puntos
A2: 1 | B2: Portugalete | D2: 2½ | E2: 2 | F2: 2 | G2: 2 | H2: 4 | I2: 2 | J2: 1 | K2: 3½ | L2: 2 | M2: 21
A3: 2 | B3: Egidazu | C3: 1½ | E3: 1½ | F3: 3 | G3: 2½ | H3: 2 | I3: 1½ | J3: 1½ | K3: ½ | L3: ½ | M3: 14½
A4: 3 | B4: Urnieta | C4: 2 | D4: 2½ | F4: 2½ | G4: 3 | H4: 3 | I4: 1½ | J4: 1½ | K4: 2½ | L4: 1½ | M4: 20
A5: 4 | B5: Fomento | C5: 2 | D5: 1 | E5: 1½ | G5: 2 | H5: 3½ | I5: 3½ | J5: 0 | K5: 2 | L5: 1 | M5: 16½
A6: 5 | B6: Sestao B | C6: 2 | D6: 1½ | E6: 1 | F6: 2 | H6: 1½ | I6: 0 | J6: 1 | K6: 1 | L6: 1½ | M6: 11½
A7: 6 | B7: San Viator | C7: 0 | D7: 2 | E7: 1 | F7: ½ | G7: 2½ | I7: 3 | J7: 3½ | K7: 1 | L7: 1½ | M7: 15
A8: 7 | B8: Easo | C8: 2 | D8: 2½ | E8: 2½ | F8: ½ | G8: 4 | H8: 1 | J8: 1 | K8: 2 | L8: 2 | M8: 17½
A9: 8 | B9: Santa Ana | C9: 3 | D9: 2½ | E9: 2½ | F9: 4 | G9: 3 | H9: ½ | I9: 3 | K9: 2 | L9: 3 | M9: 23½
A10: 9 | B10: Orvina B | C10: ½ | D10: 3½ | E10: 1½ | F10: 2 | G10: 3 | H10: 3 | I10: 2 | J10: 2 | L10: 2 | M10: 19½
A11: 10 | B11: Calasanz | C11: 2 | D11: 3½ | E11: 2½ | F11: 3 | G11: 2½ | H11: 2½ | I11: 2 | J11: 1 | K11: 2 | M11: 21

A1: 1ª Jornada (14-1-2017)
A2: Calasanz | B2: 2 | C2: 2 | D2: Portugalete
A3: Egidazu | B3: ½ | C3: 3½ | D3: Orvina B
A4: Urnieta | B4: 1½ | C4: 2½ | D4: Santa Ana
A5: Fomento | B5: 3½ | C5: ½ | D5: Easo
A6: Sestao B | B6: 1½ | C6: 2½ | D6: San Viator

A1: 2ª Jornada (21-1-2017)
A2: San Viator | B2: 1½ | C2: 2½ | D2: Calasanz
A3: Easo | B3: 4 | C3: 0 | D3: Sestao B
A4: Santa Ana | B4: 4 | C4: 0 | D4: Fomento
A5: Orvina B | B5: 1½ | C5: 2½ | D5: Urnieta
A6: Portugalete | B6: 2½ | C6: 1½ | D6: Egidazu

A1: 3ª Jornada (28-1-2017)
A2: Calasanz | B2: 3½ | C2: ½ | D2: Egidazu
A3: Urnieta | B3: 2 | C3: 2 | D3: Portugalete
A4: Fomento | B4: 2 | C4: 2 | D4: Orvina B
A5: Sestao B | B5: 1 | C5: 3 | D5: Santa Ana
A6: San Viator | B6: 3 | C6: 1 | D6: Easo

A1: 4ª Jornada (4-2-2017)
A2: Easo | B2: 3.5 | C2: =4-B2 -> 0.5 | D2: Calasanz
A3: Santa Ana | B3: 3.5 | C3: =4-B3 -> 0.5 | D3: San Viator
A4: Orvina B | B4: 0.5 | C4: =4-B4 -> 3.5 | D4: Sestao B
A5: Portugalete | B5: 2 | C5: =4-B5 -> 2 | D5: Fomento
A6: Egidazu | B6: 0.5 | C6: =4-B6 -> 3.5 | D6: Urnieta

A1: 5ª Jornada (11-2-2017)
A2: Calasanz | B2: 2½ | C2: =4-B2 -> 1½ | D2: Urnieta
A3: Fomento | B3: 1 | C3: =4-B3 -> 3 | D3: Egidazu
A4: Sestao B | B4: 2 | C4: =4-B4 -> 2 | D4: Portugalete
A5: San Viator | B5: 1 | C5: =4-B5 -> 3 | D5: Orvina B
A6: Easo | B6: 2.5 | C6: =4-B6 -> 1.5 | D6: Santa Ana

A1: 6ª Jornada (18-2-2017)
A2: Santa Ana | B2: 3 | C2: =4-B2 -> 1 | D2: Calasanz
A3: Orvina B | B3: 1.5 | C3: =4-B3 -> 2.5 | D3: Easo
A4: Portugalete | B4: 4 | C4: =4-B4 -> 0 | D4: San Viator
A5: Egidazu | B5: 1.5 | C5: =4-B5 -> 2.5 | D5: Sestao B
A6: Urnieta | B6: 2½ | C6: =4-B6 -> 1½ | D6: Fomento

A1: 7ª Jornada (25-2-2017)
A2: Calasanz | B2: 3 | C2: =4-Q59 -> 1 | D2: Fomento
A3: Sestao B | B3: 1 | C3: =4-Q60 -> 3 | D3: Urnieta
A4: San Viator | B4: 2 | C4: =4-Q61 -> 2 | D4: Egidazu
A5: Easo | B5: 2 | C5: =4-Q62 -> 2 | D5: Portugalete
A6: Santa Ana | B6: 2 | C6: =4-Q63 -> 2 | D6: Orvina B

A1: 8ª Jornada (4-3-2017)
A2: Orvina B | B2: 2 | C2: =4-Q66 -> 2 | D2: Calasanz
A3: Portugalete | B3: 1 | C3: =4-Q67 -> 3 | D3: Santa Ana
A4: Egidazu | B4: 1½ | C4: =4-Q68 -> 2½ | D4: Easo
A5: Urnieta | B5: 3 | C5: =4-Q69 -> 1 | D5: San Viator
A6: Fomento | B6: 2 | C6: =4-Q70 -> 2 | D6: Sestao B

A1: 9ª Jornada (11-3-2017)
A2: Calasanz | B2: 2½ | C2: =4-Q73 -> 1½ | D2: Sestao B
A3: San Viator | B3: ½ | C3: =4-Q74 -> 3½ | D3: Fomento
A4: Easo | B4: 2½ | C4: =4-Q75 -> 1½ | D4: Urnieta
A5: Santa Ana | B5: 2½ | C5: =4-Q76 -> 1½ | D5: Egidazu
A6: Orvina B | B6: ½ | C6: =4-Q77 -> 3½ | D6: Portugalete

A1: euskera | B1: Blog - contacto - localización