A1: Club de Ajedrez Agustín de Leiza

A1: » inicio » socios del club » cto. por equipos » últimos torneos » enlaces | B1: Liga Vasca División de Honor 2015 volver a página principal Calendario 1ª ronda 2ª ronda 3ª ronda 4ª ronda 5ª ronda 6ª ronda 7ª ronda 8ª ronda 9ª ronda Resultados individuales Orden de fuerzas 2015 1ª Ronda ˆˆ subir 2ª Ronda ˆˆ subir 3ª Ronda ˆˆ subir 4ª Ronda ˆˆ subir 5ª Ronda ˆˆ subir 6ª Ronda ˆˆ subir 7ª Ronda ˆˆ subir 8ª Ronda ˆˆ subir 9ª Ronda ˆˆ subir (*) Se juega fuera pero con los colores de casa.

C6: 1 | D6: 2 | E6: 3 | F6: 4 | G6: 5 | H6: 6 | I6: 7 | J6: 8 | K6: 9 | L6: 10 | M6: Puntos
A7: 1 | B7: Arlutz A | D7: ½ | E7: 0.5 | F7: 2½ | G7: 2 | H7: 0 | I7: 1 | J7: 1 | K7: 2 | L7: 2 | M7: =SUM(C5:L5) -> 13.5
A8: 2 | B8: Sestao A | C8: 3½ | E8: 0.5 | F8: 2½ | G8: 1.5 | H8: 2½ | I8: 3 | J8: 3½ | K8: 2 | L8: 2.5 | M8: =SUM(C6:L6) -> 8.5
A9: 3 | B9: Urnieta | C9: 3.5 | D9: 3.5 | F9: 2 | G9: 3 | H9: 0 | I9: 2 | J9: 3.5 | K9: 3.5 | L9: 2 | M9: =SUM(C7:L7) -> 13½
A10: 4 | B10: Abadiño | C10: 1½ | D10: 1½ | E10: 2 | G10: 1 | H10: 0 | I10: 1.5 | J10: 1½ | K10: 2 | L10: ½ | M10: =SUM(C8:L8) -> 11.5
A11: 5 | B11: San Viator | C11: 2 | D11: 2.5 | E11: 1 | F11: 3 | H11: 3.5 | I11: 1½ | J11: 2.5 | K11: 3.5 | L11: 2 | M11: =SUM(C9:L9) -> 15
A12: 6 | B12: Gros A | C12: 4 | D12: 1½ | E12: 4 | F12: 4 | G12: 0.5 | I12: 3 | J12: 0.5 | K12: 2½ | L12: 1.5 | M12: =SUM(C10:L10) -> 6.5
A13: 7 | B13: Conteneo | C13: 3 | D13: 1 | E13: 2 | F13: 2.5 | G13: 2½ | H13: 1 | J13: 2.5 | K13: 2.5 | L13: 0.5 | M13: =SUM(C11:L11) -> 15½
A14: 8 | B14: San Juan | C14: 3 | D14: ½ | E14: 0.5 | F14: 2½ | G14: 1.5 | H14: 3.5 | I14: 1.5 | K14: 1½ | L14: 1 | M14: =SUM(C12:L12) -> 17
A15: 9 | B15: Batalla | C15: 2 | D15: 2 | E15: 0.5 | F15: 2 | G15: 0.5 | H15: 1½ | I15: 1.5 | J15: 2½ | L15: 2 | M15: =SUM(C13:L13) -> 7.5
A16: 10 | B16: Orvina | C16: 2 | D16: 1.5 | E16: 2 | F16: 3½ | G16: 2 | H16: 2.5 | I16: 3.5 | J16: 3 | K16: 2 | M16: =SUM(C14:L14) -> 14.5

A1: 1ª Jornada (10-1-2015)
A2: (*)Arlutz A | B2: 2 | C2: 2 | D2: Orvina
A3: Sestao A | B3: 2 | C3: 2 | D3: Batalla
A4: Urnieta | B4: 1½ | C4: 2½ | D4: San Juan
A5: Abadiño | B5: 2½ | C5: 1½ | D5: Conteneo
A6: Gros A | B6: 3½ | C6: ½ | D6: San Viator

A1: 2ª Jornada (17-1-2015)
A2: (*)Orvina | B2: 2 | C2: 2 | D2: Gros A
A3: Conteneo | B3: 2½ | C3: 1½ | D3: San Viator
A4: San Juan | B4: 2½ | C4: 1½ | D4: Abadiño
A5: Batalla | B5: 2 | C5: 2 | D5: Urnieta
A6: Arlutz A | B6: ½ | C6: 3½ | D6: Sestao A

A1: 3ª Jornada (24-1-2015)
A2: (*)Sestao A | B2: 3 | C2: 1 | D2: Orvina
A3: Urnieta | B3: 1 | C3: 3 | D3: Arlutz A
A4: Abadiño | B4: 2 | C4: 2 | D4: Batalla
A5: San Viator | B5: 2½ | C5: 1½ | D5: San Juan
A6: Gros A | B6: 3 | C6: 1 | D6: Conteneo

A1: 4ª Jornada (31-1-2015)
A2: (*)Orvina | B2: 3.5 | C2: =4-B2 -> 0.5 | D2: Conteneo
A3: San Juan | B3: 3.5 | C3: =4-B3 -> 0.5 | D3: Gros A
A4: Batalla | B4: 0.5 | C4: =4-B4 -> 3.5 | D4: San Viator
A5: Arlutz A | B5: 2½ | C5: =4-B5 -> 1½ | D5: Abadiño
A6: Sestao A | B6: 0.5 | C6: =4-B6 -> 3.5 | D6: Urnieta

A1: 5ª Jornada (7-2-2015)
A2: (*)Urnieta | B2: 2 | C2: =4-B2 -> 2 | D2: Orvina
A3: Abadiño | B3: 1½ | C3: =4-B3 -> 2½ | D3: Sestao A
A4: San Viator | B4: 2 | C4: =4-B4 -> 2 | D4: Arlutz A
A5: Gros A | B5: 2½ | C5: =4-B5 -> 1½ | D5: Batalla
A6: Conteneo | B6: 2.5 | C6: =4-B6 -> 1.5 | D6: San Juan

A1: 6ª Jornada (14-2-2015)
A2: (*)Orvina | B2: 3 | C2: =4-B2 -> 1 | D2: San Juan
A3: Batalla | B3: 1.5 | C3: =4-B3 -> 2.5 | D3: Conteneo
A4: Arlutz A | B4: 0 | C4: =4-B4 -> 4 | D4: Gros A
A5: Sestao A | B5: 1.5 | C5: =4-B5 -> 2.5 | D5: San Viator
A6: Urnieta | B6: 2 | C6: =4-B6 -> 2 | D6: Abadiño

A1: 7ª Jornada (21-2-2015)
A2: (*)Abadiño | B2: ½ | C2: =4-Q59 -> 3½ | D2: Orvina
A3: San Viator | B3: 1 | C3: =4-Q60 -> 3 | D3: Urnieta
A4: Gros A | B4: 1½ | C4: =4-Q61 -> 2½ | D4: Sestao A
A5: Conteneo | B5: 3 | C5: =4-Q62 -> 1 | D5: Arlutz A
A6: San Juan | B6: 1½ | C6: =4-Q63 -> 2½ | D6: Batalla

A1: 8ª Jornada (28-2-2015)
A2: (*)Orvina | B2: 2 | C2: =4-Q66 -> 2 | D2: Batalla
A3: Arlutz A | B3: 1 | C3: =4-Q67 -> 3 | D3: San Juan
A4: Sestao A | B4: 3 | C4: =4-Q68 -> 1 | D4: Conteneo
A5: Urnieta | B5: 0 | C5: =4-Q69 -> 4 | D5: Gros A
A6: Abadiño | B6: 1 | C6: =4-Q70 -> 3 | D6: San Viator

A1: 9ª Jornada (7-3-2015)
A2: San Viator | B2: 2 | C2: =4-Q73 -> 2 | D2: Orvina
A3: Gros A | B3: 4 | C3: =4-Q74 -> 0 | D3: Abadiño
A4: Conteneo | B4: 2 | C4: =4-Q75 -> 2 | D4: Urnieta
A5: San Juan | B5: ½ | C5: =4-Q76 -> 3½ | D5: Sestao A
A6: Batalla | B6: 2 | C6: =4-Q77 -> 2 | D6: Arlutz A

A1: euskara | B1: contacto - localización